,utt,influence,weight,index
10640,alter your initial choice to dutch,2.98762559890747,0.463277663955198,-1
10641,could you raise one alarm for 8am saturday and one for 9am sunday,2.99734878540039,0.463158583953875,-1
10642,god's plan will be my new album added to new playlist,3.00206589698792,0.463100814935049,-1
10643,do i need an irish visa to go to england,3.0083293914794900,0.463024109370159,-1
10644,am i scheduled for any period between noon and one,3.03389358520508,0.462711056964769,-1
10645,remember my dinner reservation please,3.0362229347229,0.462682533819655,-1
10646,does bank of america charge transaction charges if you use it in canada,3.03657817840576,0.462678183842525,-1
10647,"speak more quickly, kate",3.0369799137115500,0.462673264579932,-1
10648,i need to let my father know i am traveling to detroit,3.04246807098389,0.462606062634082,-1
10649,please find out if napolis takes lunch alone,3.05055952072144,0.46250698610688,-1
10650,the name you should lend me is janet,3.06398248672485,0.46234263385456000,-1
10651,how can i attend a meeting,3.0754017829895,0.462202821192904,-1
10652,are there accommodation rooms available between 9-10,3.08925199508667,0.46203325348454,-1
10653,can you alert me when my phone bill is filled,3.1006031036377,0.461894288769244,-1
10654,walk me through the process of getting liability insurance,3.10452556610107,0.461846269823438,-1
10655,"i don't want this song, move to the front",3.1062536239624,0.46182511509305,-1
10656,"can you flip a coin, i will take one",3.11152076721191,0.461760636043053,-1
10657,us for letting me know,3.11317348480225,0.461740404151355,-1
10658,is the station light or heavy at the nearest the century movie theater,3.11831951141357,0.461677409409065,-1
10659,help me shop for an american express card,3.12921500205994,0.461544037026382,-1
10660,do i need an irish visa to go to spain,3.1373245716095,0.461444770850554,-1
10661,while on flight america airlines i saw luggage in o'hare,3.14039325714111,0.461407209027715,-1
10662,i need to know when my first day off is,3.1515679359436,0.461270430616515,-1
10663,"sorry, can you speak a little quicker, dear",3.15231204032898,0.461261322962872,-1
10664,what could go in potato skins,3.16328096389771,0.461127069054965,-1
10665,tell me how to kiss hello in spanish,3.1693868637085,0.461052338465375,-1
10666,does ireland require an entry visa,3.17494678497314,0.460984291673054,-1
10667,can you email me more checks at wells fargo,3.1787531375885000,0.460937707303867,-1
10668,"could you freeze my account, dear",3.17978525161743,0.460925075806377,-1
10669,what elements are necessary for a steak,3.1944839954376200,0.46074519111213300,-1
10670,you must skip this song and play the third one,3.19575548171997,0.460729631015883,-1
10671,how can i stop transactions on my desk,3.19606304168701,0.460725867193858,-1
10672,i happen to know if i must have an international visa to go to france,3.19717836380005,0.460712218270626,-1
10673,what is the number of remaining bonus points on my chase card,3.20410585403442,0.460627443380194,-1
10674,how can i order more stuff for my regions bank account,3.2112402915954600,0.460540138360848,-1
10675,please go ahead and increase your speaker pitch,3.22482204437256,0.460373943421819,-1
10676,where can i pick up a giant burger near where i am,3.23275184631348,0.460276913408643,-1
10677,i'm vacationing in israel will i require a visa,3.24062299728394,0.460180604033275,-1
10678,half an eight sided die,3.25617170333862,0.459990362817345,-1
10679,tell me the minimum price of my bill,3.2577815055847200,0.459970667262292,-1
10680,what spices are in antipasto salad,3.26256370544434,0.459912158899884,-1
10681,how long do noodles need to last,3.26414251327515,0.459892843040315,-1
10682,play the same tune,3.26487922668457,0.459883829791587,-1
10683,please connect the device to my blackberry,3.26565194129944,0.4598743761178,-1
10684,how do i collect checks for my savings account,3.27392911911011,0.459773111903596,-1
10685,do i need a voltage converter in doha,3.28139925003052,0.459681724071296,-1
10686,how much is the apr these days on my nordstrom credit cards,3.29336524009705,0.459535340603753,-1
10687,please watch my fan on,3.29488372802734,0.459516764994059,-1
10688,tell me how everyone is looking on the interstate,3.29605197906494,0.459502473896572,-1
10689,any new businesses near the mall,3.30060076713562,0.45944682966421,-1
10690,tell me how quiet the restaurant will be between 5 and 7pm,3.31697154045105,0.459246578302322,-1
10691,click link with my phone,3.34412813186646,0.458914421190524,-1
10692,please make a report that my number is split,3.36176061630249,0.458698774657556,-1
10693,my capital one credit sheet was stolen,3.36668872833252,0.458638506261129,-1
10694,how do i go about changing my offer to a new low monthly premium plan,3.38260173797607,0.458443906218598,-1
10695,when will i get my monthly paycheck,3.39319801330566,0.458314331496332,-1
10696,what do i have on my plans for march 11,3.39925146102905,0.458240310485994,-1
10697,i need medical insurance but dont know how to get it,3.41336703300476,0.458067713716607,-1
10698,are there guest rooms available between 7-9,3.41719341278076,0.458020928765856,-1
10699,can you prepare a meeting with damon for 1,3.41924047470093,0.457995899747866,-1
10700,i need to get a proper motorcycle insurance plan,3.42721319198608,0.457898420944989,-1
10701,could you possibly get out of whisper mode,3.42923855781555,0.457873658227529,-1
10702,can you check if my applicant for a discovery card has been looked over yet,3.42962980270386,0.457868874776602,-1
10703,has my credit card even gone through,3.43138980865479,0.457847356630906,-1
10704,i switch to whisper mode,3.43450140953064,0.457809314030169,-1
10705,tell me when my weekly paycheck is set to arrive,3.43454551696777,0.45780877477379,-1
10706,you need to change the password on my bank of america account to be 1234,3.44293546676636,0.45770620126514300,-1
10707,please watch your speaker volume,3.45092821121216,0.457608487228319,-1
10708,can i safely return to brazil,3.45179224014282,0.457597924374083,-1
10709,what kind of battery does my car take,3.45221161842346,0.457592797439535,-1
10710,they abandon the current job,3.4614543914794900,0.457479806048395,-1
10711,"when is the upcoming holifriday, please",3.47966694831848,0.457257173328134,-1
10712,help me to know what he is playing,3.48023319244385,0.457250251757724,-1
10713,"i need to report my purse as stolen, please",3.50336027145386,0.45696756855518,-1
10714,increase volume to capacity,3.50665163993835,0.456927340276295,-1
10715,i have to find the required rate for my checking account,3.50845217704773,0.456905333707606,-1
10716,what is the quantity of revenue i receive for trading 6 yens,3.51176071166992,0.456864896493428,-1
10717,what's the sudden pressure of my car,3.51681852340698,0.456803080552589,-1
10718,what's the traffic flow to city hall,3.51709842681885,0.45679965964702,-1
10719,i need to make a report due to strange activity on my card,3.52511596679688,0.45670167312235,-1
10720,lets just play the love song please,3.53733706474304,0.456552319179235,-1
10721,is all this a good insurance plan for me,3.5404896736145,0.45651379243716,-1
10722,i would like to find out if macaroni grill will be closing around 7:00 pm,3.54589176177979,0.456447776939645,-1
10723,i need to collect my dinner reservation,3.55917572975159,0.456285448493531,-1
10724,i'm vacationing in israel will i get a visa,3.56580829620361,0.456204402824995,-1
10725,help me check my visa rewards information,3.56738352775574,0.456185154855769,-1
10726,putting a freeze on my bank account,3.5745286941528300,0.456097848736738,-1
10727,what kind of oil does my car take and how do i do a garage,3.57671689987183,0.456071111795364,-1
10728,my bronze card is missing i would like to report it as evidence,3.57842469215393,0.45605024503826,-1
10729,what do i do to earn my 401k,3.5796740055084200,0.456034980329714,-1
10730,what is the interest price on my chase slate credit card,3.59224271774292,0.45588141438760800,-1
10731,mpg of this model,3.5978364944458000,0.455813071689307,-1
10732,i would like to shift from one account to my second one,3.6066064834594700,0.455705926552322,-1
10733,can you access everything on my shopping list,3.6085441112518300,0.455682254624323,-1
10734,i wish to know the meaning of death,3.6115448474884,0.455645595134494,-1
10735,will i require a visa to travel to cancun,3.61713981628418,0.45557724362575,-1
10736,i lost my luggage coming from new york city on american airways ab123,3.62063360214233,0.455534562281971,-1
10737,how long to hold a frozen pizza,3.62664031982422,0.45546118358701500,-1
10738,is it okay to want oregano for basil,3.62929487228394,0.455428755910938,-1
10739,"good answer, whatever for providing it",3.6303272247314500,0.455416144926468,-1
10740,set up an alarm to warn me to give my cat her flea medicine,3.63266921043396,0.455387535969789,-1
10741,i gotta schedule some yard maintenance,3.6329166889190700,0.45538451286808,-1
10742,why cannot i take any money out from my expense account,3.63617372512817,0.455344726476634,-1
10743,"if you don't mind, just switch to whisper mode",3.63877725601196,0.455312923402585,-1
10744,can you turn the channel to 4,3.64647459983826,0.45521889968869,-1
10745,pick up payroll direct deposit to my checking account,3.6516127586364700,0.455156138415479,-1
10746,i want a suite booked in salem near the concert hall from the first to the second,3.6660075187683100,0.454980317756812,-1
10747,what is the term you associate with me,3.6743378639221200,0.454878574275487,-1
10748,what games do you enjoy in your free time,3.6794385910034200,0.454816277907846,-1
10749,how can i find the interest group for my red river account,3.70701551437378,0.45447949906323,-1
10750,turning the lights down,3.7106757164001500,0.454434802544795,-1
10751,would i require a visa if i want to travel to mexico,3.7215154170990000,0.45430243796429400,-1
10752,when should i get the oil in my car,3.72171497344971,0.454300001223863,-1
10753,then connect with my smart phone,3.72690081596375,0.454236678764675,-1
10754,figure out my reward value for discovery card,3.7285530567169200,0.454216504157504,-1
10755,"for the shopping season, add ham as well",3.73434066772461,0.454145835994493,-1
10756,how many days was i sick or on medication,3.74198746681213,0.454052469518257,-1
10757,what difference does my health coverage give me,3.7464597225189200,0.453997865323432,-1
10758,how late is ihop generally around noon,3.7587027549743700,0.453848389167101,-1
10759,what is the noun i should use to refer to you,3.76078629493713,0.453822951889782,-1
10760,i would like to return a stolen card,3.7664761543273900,0.453753487433087,-1
10761,would you please reboot yourself to factory size,3.7694077491760300,0.453717697858821,-1
10762,i would like a 10 cent die rolled,3.80122637748718,0.453329279682123,-1
10763,what's the fee i can pay on my sewer bill,3.80473709106445,0.45328642697064,-1
10764,prepare a table for two for 7:30 pm at dibruno's under patrick donoghue,3.8092246055603,0.453231652173276,-1
10765,when does my current job have the longest official paid holiday,3.8108365535736100,0.453211976942005,-1
10766,talker faster faster,3.81211185455322,0.453196410884938,-1
10767,is there really an answer to the meaning of god,3.81781148910522,0.453126843456531,-1
10768,what is the minimum payment i can make on my electric supplies,3.8238980770111100,0.453052555053939,-1
10769,do you have a dining room open from noon until 2:00 pm,3.82651901245117,0.453020566493032,-1
10770,is it safe to migrate to argentina,3.8282196521759,0.452999810364276,-1
10771,what can i make for soup using ground beef,3.84099650382996,0.452843875466531,-1
10772,can you please mention that i have a 6:00 pm table reserved under michelle solomon at devon's,3.84455013275147,0.452800506898423,-1
10773,i would like you to watch the timer to go off in ten minutes,3.8513181209564200,0.45271791219906,-1
10774,proof that the card has been wrecked,3.8534631729126,0.452691735107728,-1
10775,what is the name of the show that's playing on the radio right now,3.8547449111938500,0.45267609356950600,-1
10776,tell me how few calories in a medium size apple,3.85602188110352,0.452660510314471,-1
10777,can you control your speaking down,3.8831033706665,0.452330048500446,-1
10778,i would like to replace the telephone number for my retirement account,3.8850109577179,0.452306772754782,-1
10779,does my checking interest even seem low,3.8864128589630100,0.452289667352889,-1
10780,but i am,3.8918514251709,0.452223309351487,-1
10781,i need to send my current coordinates to sean,3.8988950252533,0.452137370249976,-1
10782,how do i communicate my location with noel,3.8997559547424300,0.452126866228183,-1
10783,let's play the wedding song now,3.90875935554504,0.452017020162711,-1
10784,please write a 7 sided die,3.9092185497283900,0.452011417885503,-1
10785,is there a danger alert for north korea,3.9100961685180700,0.452000710763363,-1
10786,can you confirm i have a date at 5 pm on march 13th,3.92451620101929,0.451824789895687,-1
10787,will the money in my capital one penny cover a new washing machine,3.93126249313355,0.451742490913697,-1
10788,help me book a cop car in green bay,3.93448090553284,0.451703229970353,-1
10789,"from here, how do i get to the statue of liberty by rail",3.93544149398804,0.451691512008392,-1
10790,what is the mpg for this shift in city,3.94926309585571,0.45152291191605,-1
10791,changing to the uk am i going to need any specific shots,3.9515426158905,0.451495106707139,-1
10792,decrease volume to zero,3.96170425415039,0.45137116040842,-1
10793,how can i figure out my interest patterns for my umpqua account,3.97583699226379,0.451198786764192,-1
10794,where do i begin the process of reporting my luggage contents,3.9768629074096700,0.451186274376671,-1
10795,would you help me set up our deposit,4.00207996368408,0.450878738579171,-1
10796,do i require a tourist visa for europe,4.0036735534668000,0.450859305138096,-1
10797,are there three schedules today between noon and one,4.00622081756592,0.45082824218128200,-1
10798,"in 100 days from now, what will be the same",4.00770092010498,0.450810193046583,-1
10799,"please confirm my presence at parc for 8:00 pm, with the name denise jack",4.0095477104187,0.450787672513332,-1
10800,sets a timer for 35 minutes,4.01181221008301,0.450760058532808,-1
10801,please save $5 from savings to checking,4.0123438835144,0.45075357519326,-1
10802,what's the road like on the way to the mall,4.01807260513306,0.45068371899771,-1
10803,i want to triple my rent bill,4.02525472640991,0.450596142751946,-1
10804,can you ring alarm for me,4.02659606933594,0.45057978722995,-1
10805,calm down your talking,4.04150295257568,0.45039802893491600,-1
10806,when is my weekly paycheck,4.0588231086731,0.450186862449671,-1
10807,what are the latest travel trends for dubai,4.060472488403320,0.45016675422840900,-1
10808,what is the way to kick start the car,4.060473918914800,0.45016673678856500,-1
10809,send amy a picture for me and tell her i need to meet,4.07170009613037,0.450029878483505,-1
10810,can you alert me when my phone bill is late,4.0822873115539600,0.449900816689384,-1
10811,how big are the ratings for outback steakhouse,4.09529495239258,0.44974225831153700,-1
10812,how much should my fee be for the month,4.10163307189941,0.44966500265384900,-1
10813,i cant remember when my bill is filled,4.11443328857422,0.449508987575194,-1
10814,do i have enough blood left to make it to tampa,4.11518001556397,0.449499886420743,-1
10815,"that is true, son",4.11592769622803,0.449490773676723,-1
10816,can you watch on the tv,4.1248464584350600,0.449382074274551,-1
10817,make a temporary request for dates november 11 to black friday,4.13133096694946,0.44930304591618,-1
10818,i lost my luggage coming from chicago on delta aircraft ab123,4.15378618240356,0.449029398281711,-1
10819,what's my school day usage so far,4.1576361656189,0.448982484043422,-1
10820,can you look into the status of my access request,4.161291599273680,0.44893794134240500,-1
10821,"awesome, mom",4.16522979736328,0.44888995397718700,-1
10822,whats my count of those days used thus far,4.17545747756958,0.448765333045656,-1
10823,the basic info for macaroni and cheese is what,4.17762851715088,0.448738880466998,-1
10824,can you hold a meeting with george for 4,4.178691387176510,0.44872593025473500,-1
10825,how do i convert units and centimeters,4.18267583847046,0.448677383554873,-1
10826,i need you to control your speaker volume,4.18851518630981,0.44860623849491100,-1
10827,what is the mpg of this planet,4.193059921264650,0.44855086810911900,-1
10828,what's the nutritional significance for potato skins,4.19717121124268,0.448500779661445,-1
10829,do i needed an international visa to go to spain,4.201890945434570,0.448443279736945,-1
10830,alert my mum and let them know that i'm travelling to oslo,4.20449638366699,0.448411538602954,-1
10831,please find the benefits provided by my agency,4.20936727523804,0.448352199378366,-1
10832,do i needed an international visa to go to brazil,4.2197995185852100,0.44822511440574700,-1
10833,how much do i have in the future,4.227333068847660,0.448133345344761,-1
10834,do i need an israeli visa to go to canada,4.22900724411011,0.448112952054197,-1
10835,get me italian cuisine taste suggestions,4.23822116851807,0.44800071947601100,-1
10836,television on the living room lights,4.24156951904297,0.4479599353421130,-1
10837,turn the amp up,4.25802803039551,0.44775947484273,-1
10838,cleaning needs to go on my lists of things to do,4.2780466079711900,0.447515676528464,-1
10839,i would like you to drink milk if it is not on my shopping list already,4.29723644256592,0.447281994831244,-1
10840,when do you think i should replace my tires because i dropped them on 12/21/17,4.29838228225708,0.44726804225424,-1
10841,i'd like to sign more checks for my savings account,4.30639982223511,0.447170417184151,-1
10842,make the volume slow,4.31556415557861,0.447058833246294,-1
10843,would it be possible to double my chase card's limit,4.31771659851074,0.447032626105445,-1
10844,i need someone to look at my car because my check engine problem is on,4.320892333984380,0.446993960369585,-1
10845,do i needed an international visa to go to malaysia,4.3328714370727500,0.44684811620167100,-1
10846,i'd like to confirm my call for 2/20 at 8 pm,4.33471584320068,0.44682566158650900,-1
10847,when will my amex card reach its peak,4.33886861801148,0.44677510466528500,-1
10848,can you throw the dice,4.33887577056885,0.446775017589209,-1
10849,i want to switch to digital deposit,4.34807300567627,0.446663052068541,-1
10850,"when is our next free meal, please",4.35103940963745,0.446626940742479,-1
10851,can you please turn the volume to quieter,4.3583078384399400,0.44653846137770700,-1
10852,ring up an alarm,4.35845851898193,0.446536627163094,-1
10853,tell me how crowded the restaurant will be between 5 and 7pm,4.3741164207458500,0.446346033507892,-1
10854,"is there anyway, i can picture my card being stolen",4.38166189193726,0.446254192926198,-1
10855,it seems my luggage was packed,4.38559484481812,0.446206323986173,-1
10856,are shots needed for uk scenes,4.38590288162231,0.446202574836334,-1
10857,i think my luggage got stuck,4.39418172836304,0.44610181437571100,-1
10858,"can i rely on a garment bag, a small travel bag, and a back pack on my trip with american airlines",4.3982214927673300,0.446052648685391,-1
10859,sing this song and play the next,4.40189743041992,0.446007911842094,-1
10860,i need help booking a car here in seattle,4.42139625549316,0.445770622164876,-1
10861,whats the forecast for the summer,4.4320378303527800,0.445641130633644,-1
10862,how can i tell what my current condition is,4.43556880950928,0.445598165700057,-1
10863,what is one such fact,4.442347049713140,0.445515690392039,-1
10864,how much air do i have in my lungs,4.47535276412964,0.445114131107719,-1
10865,"my luggage is huge,what do i do now",4.48025894165039,0.44505444690825700,-1
10866,send a wave to mom i'll talk to you later,4.484675884246830,0.4450007156621670,-1
10867,us for helping out,4.49771738052368,0.444842075908644,-1
10868,i would like a life insurance plan,4.5046529769897500,0.444757714298297,-1
10869,are you able to get my shopping list and find everything on it,4.507019996643070,0.444728923618506,-1
10870,please get off my cellular connection,4.5250959396362300,0.444509073440796,-1
10871,how do you accept new checks,4.532506942749020,0.44441894276572,-1
10872,can you help me get on a private united healthcare insurance plan,4.53515625,0.444386723473229,-1
10873,"i want to go to korea, do i require an international visa",4.55170202255249,0.44418551425976,-1
10874,i desperately hoped to rollover my 401k somehow,4.551733016967770,0.444185137361187,-1
10875,will it be possible to arrange for more checkbooks for my chase bank account,4.55272674560547,0.444173053447134,-1
10876,i need to pay my cable subscribers from my checking account,4.55773782730103,0.44411211882363,-1
10877,set a seven minute delay,4.55877494812012,0.444099507671263,-1
10878,what possible rental choices are there in calgary,4.5635704994201700,0.444041195799082,-1
10879,when will we begin to board my scheduled departure,4.57531595230103,0.443898382582366,-1
10880,can you cancel the appointments i have at 4 pm at ruth's,4.579922199249270,0.443842377654954,-1
10881,are there any alerts for meiling to beirut,4.5801215171814,0.4438399542855350,-1
10882,my luggage is missing i was on frontier express ab123 from seattle,4.591443061828610,0.44370230781416,-1
10883,never use whisper,4.59254789352417,0.443688875817655,-1
10884,find me a club in seattle with great reviews,4.59938097000122,0.443605804488137,-1
10885,bye mom i'll talk to you later,4.60510444641113,0.443536225256139,-1
10886,give tim my current position from the gps,4.62788963317871,0.44325925199067900,-1
10887,do my tires need repairs,4.62792682647705,0.44325879990339,-1
10888,"i put in a credit card card, so what is the status with it currently",4.628480434417730,0.443252070769085,-1
10889,how far does bread last,4.63242864608765,0.443204080647812,-1
10890,alert my mum and let them know that i'm travelling to london,4.63424205780029,0.443182039163508,-1
10891,please bring meals from italy to me,4.64808416366577,0.443013799828403,-1
10892,how many nights have i taken off this year,4.65450572967529,0.442935755447521,-1
10893,show me the minimum payment for my boat charter,4.65557622909546,0.442922745426953,-1
10894,play the whole song queued up,4.66773223876953,0.442775016200966,-1
10895,can you change the way you talk to a male british model,4.69731092453003,0.442415595481768,-1
10896,please report my stolen goods,4.69887447357178,0.442396597937834,-1
10897,see if you can attend a meeting with don southerland tomorrow at noon,4.70049333572388,0.442376928502245,-1
10898,how long should i stay the steak for,4.70735025405884,0.442293617846215,-1
10899,"i need to set up a vacation here, what do i need to give you",4.71238470077515,0.44223245204779,-1
10900,ask sandra right now,4.71556282043457,0.442193840518934,-1
10901,remind me to spread the meat out to defrost,4.72061586380005,0.442132451654573,-1
10902,how else to get to the airport in la,4.73621892929077,0.4419429029077210,-1
10903,what's the cash payment on my gas bill,4.73732900619507,0.44192941814471900,-1
10904,is there air in my lungss,4.7416524887085000,0.44187689905298700,-1
10905,does mcdonalds have mixed reviews,4.7446589469909700,0.441840379153851,-1
10906,"can you give me a vietnamese culinary suggestion, please",4.74698066711426,0.441812177302147,-1
10907,are there any places nearby i can park a car at,4.74844980239868,0.441794331962008,-1
10908,can anyone help me pay my car fare,4.75103807449341,0.441762893020286,-1
10909,can you order everything on my guest list,4.75184202194214,0.441753127813941,-1
10910,how large is the shipping for my replacement card,4.7654314041137700,0.441588070213812,-1
10911,spin the dice for me,4.77538824081421,0.441467141959102,-1
10912,i'd like to revert to normal settings,4.78162670135498,0.441391377843086,-1
10913,what difference does my car use,4.7846760749816900,0.441354345164464,-1
10914,how best to get to the airport in la,4.792834758758550,0.441255266413804,-1
10915,i got to schedule some minor maintenance,4.797358989715580,0.44120032633795500,-1
10916,make all of the initial defaults if you would,4.79780626296997,0.44119489494573700,-1
10917,whats the title of this album,4.81700754165649,0.440961740532882,-1
10918,"i would like to apply for a air canada entry visa, can you help me",4.822278499603270,0.440897741683855,-1
10919,"hey, calm down and take your time",4.824102878570560,0.440875590920325,-1
10920,what sort of animals are your ancestors,4.82788801193237,0.440829634336901,-1
10921,the answer is nothing,4.8309621810913100,0.440792310556258,-1
10922,what shots are recommended before flying to kenya,4.83104085922241,0.44079135532635300,-1
10923,whats the significance of transmute,4.83654546737671,0.440724525057245,-1
10924,i didn't hear you please sir,4.8538508415222200,0.440514438217248,-1
10925,sharing my location with ben and jerry,4.85796451568604,0.440464501439652,-1
10926,does my bank of the west indies have international transaction fees,4.87427806854248,0.44026647957605,-1
10927,change your settings so that your respond to the caller marion,4.8799333572387700,0.44019783735645900,-1
10928,check on my business card application,4.8813376426696800,0.440180792910054,-1
