,utt,influence,weight,index
0,bring in rewards for my visa card,-106.072608947754,0.9946461138457080,-1
1,how can i factor in rewards on my discover card,-86.70803833007810,0.986221479704648,-1
2,how do calculate the credit limit on my visa card,-41.4167327880859,0.884929679987077,-1
3,can you cancel my reservation for chillis at 8:00,-38.830802917480500,0.871310493179916,-1
4,in what month will my card reach him,-33.647857666015600,0.83987682726362,-1
5,did my vacation get shorter,-27.298120498657200,0.793238521619708,-1
6,am i going to be able to get my vacation back,-23.2232608795166,0.758386262800408,-1
7,i want to know if i can match my credit card points now,-23.1412620544434,0.7576454313603700,-1
8,is there a schedule for my aa meeting on my list,-22.863466262817400,0.755124177176606,-1
9,what are the techniques to make shepherd's pie,-20.5511531829834,0.733458078435272,-1
10,go through all the articles on my list and state what they are,-20.1862487792969,0.729929651360375,-1
11,that is a lie,-18.7699279785156,0.715959214995189,-1
12,what is the approximate date of my wells fargo card,-15.904032707214400,0.686400983755254,-1
13,i want to use the knowledge that my points have earned on my credit card,-15.3548040390015,0.680548752483711,-1
14,what are the necessary visas for travel to africa,-14.8344268798828,0.674950926105395,-1
15,please tell me the procedure to include in my rewards for my citibank card,-13.650404930114700,0.662028109032348,-1
16,add apples to my to do business list,-13.0272979736328,0.655127344253694,-1
17,"is bacon on my shopping list, even if it's not",-9.96128845214844,0.620257027307834,-1
18,what are all of the recipes for brownies from scratch,-9.54079627990723,0.615366748128287,-1
19,examples include feeding the fish on my to do list,-7.29870367050171,0.588918123615368,-1
20,in what month will my card reach zero,-6.9851999282836900,0.585174769808321,-1
21,how best to get a new credit card,-6.36046695709229,0.577686225593985,-1
22,keep playing right now,-6.154888153076170,0.575213986480117,-1
23,can you compare cherrios to my shopping list,-6.14616346359253,0.575108981357568,-1
24,"on my to do list, including cleaning",-5.93221378326416,0.572531912454068,-1
25,i need a calciumion for a dinner recipe,-5.4675588607788100,0.566921648336007,-1
26,do you know if my vacation period is still pending,-5.2787771224975600,0.564637293710008,-1
27,tell me how to use credit scoring points,-4.73723030090332,0.558069382826988,-1
28,can i know your name please,-4.67741298675537,0.557342624492019,-1
29,how much am i paying from my income in london,-4.63750267028809,0.55685759205639,-1
30,i want to know my bill's after payment,-4.34894275665283,0.55334753584685,-1
31,do i need a certain amount of points before i can win them,-4.05712509155273,0.549792436201962,-1
32,add bread to my collection of things to buy,-3.49544739723206,0.542935715179613,-1
33,what is a good chili peppers,-3.39147639274597,0.541664616347225,-1
34,please accept my 7:30 reservation for morton's,-3.12991690635681,0.538464554839494,-1
35,tell me what is on my yahoo list,-3.0907735824585,0.537985374726714,-1
36,examples include laundry on my to do list,-3.06518959999084,0.537672145770723,-1
37,during what month will my card's publication date fall on,-2.91812610626221,0.53587105361767,-1
38,go through all the sites on my list and state what they are,-2.82987260818481,0.534789757231829,-1
39,do i need permission to travel overseas,-2.78730154037476,0.534268051935646,-1
40,what is on my yahoo list,-2.67690801620483,0.532914840926547,-1
41,what's my vacation here,-2.6692943572998,0.532821494115646,-1
42,i have a lot of points saved up from my credit card rewards but don't know how to manage them,-2.66336870193481,0.532748841380946,-1
43,extra payment for my credit card,-2.64930510520935,0.532576406163085,-1
44,what is the excuse i need to pay for my cell phone bill,-2.59378623962402,0.531895607983952,-1
45,i need to know the content of my list of assignments,-2.39777565002441,0.529491101982226,-1
46,how else do i have to pay for my cable bill,-2.20241951942444,0.527093261505886,-1
47,complete payment of my bill please,-2.03345251083374,0.52501831387165,-1
48,what's my bill going to be for my funeral for tennessee,-2.0117962360382100,0.524752306636009,-1
49,can i place my reservation for 4 at red robin,-1.9940128326416,0.52453385994409,-1
50,do they have reservations at bar tartine,-1.98999440670013,0.524484497343817,-1
51,can you imagine how much i can spend on my visa,-1.98905062675476,0.524472903821427,-1
52,how much do i have to pay for my vitamins this month,-1.98663473129272,0.524443226509814,-1
53,what is the essence of altruism,-1.9534171819686900,0.524035158506693,-1
54,the door please,-1.7760591506958,0.521855836412491,-1
55,is there a list of recommended places to get before travelling to kenya,-1.6069084405899,0.519776586772556,-1
56,what is the essence of intelligent,-1.57524299621582,0.51938726762111,-1
57,turn the heat up,-1.56981229782105,0.519320496090057,-1
58,what might pique your interest,-1.5413191318512,0.518970155618587,-1
59,i need to know the bill's after payment,-1.51196837425232,0.518609251044652,-1
60,what is my daily payday,-1.50199317932129,0.51848658900472,-1
61,will my vacation be extended soon,-1.5007449388504,0.518471239601396,-1
62,what could pique your interest,-1.44315242767334,0.517762996729313,-1
63,please turn on the television,-1.42520201206207,0.517542237092031,-1
64,i don't have much so can i order some new ones,-1.4216003417968800,0.517497941834775,-1
65,what are ai's powers,-1.40121507644653,0.517247227832494,-1
66,what's the tripleal value for a pizza lunchable,-1.39217758178711,0.517136074840127,-1
67,did i add to my mental list that i need to take the car in for an oil change,-1.36501288414001,0.516801963517607,-1
68,what's the tripleal info for a loaf of bread,-1.35338997840881,0.516659003357175,-1
69,whats your business,-1.33373498916626,0.516417243469149,-1
70,is my credit card his date approaching,-1.2960798740387,0.515954057440594,-1
71,i need a suggestion for a cake recipe,-1.2888969182968100,0.515865698584761,-1
72,set a callerer for me to call my brother at 8 pm,-1.27581572532654,0.515704781886819,-1
73,what's he usually like around 5pm going to the bank,-1.2546856403350800,0.515444845862263,-1
74,i need to report a card that's been dropped but i dont know how,-1.14435577392578,0.514087468116513,-1
75,can i turn on the lamp now,-0.973327159881592,0.511982915943484,-1
76,i need you to control your volume,-0.965668141841888,0.511888659212017,-1
77,what are the best questions,-0.953527390956879,0.511739245705302,-1
78,will they have reservations at chillis,-0.945084273815155,0.511635336912054,-1
79,"if i'm heading to the mall at 5:00, what will the night be like",-0.943614900112152,0.511617253339929,-1
80,i need to order new clothing,-0.885635256767273,0.51090367447628,-1
81,can i turn on the television now,-0.874687194824219,0.510768927184509,-1
82,please reset your factory clock,-0.855466783046722,0.510532361136531,-1
83,how can i claim rewards earned through my amex card,-0.843638300895691,0.510386773075783,-1
84,turn down your television,-0.803659081459045,0.509894685459575,-1
85,remind me of the date of my last birthday,-0.7430220246315,0.509148292812309,-1
86,please wait for car meet,-0.714339315891266,0.508795217679311,-1
87,"ai, what's your emergency",-0.700158178806305,0.508620649073824,-1
88,how old is my gas bill,-0.696081876754761,0.508570469747342,-1
89,i'd like to turn up the heat,-0.68590384721756,0.508445177331608,-1
90,"ai, ai!",-0.68120688199997,0.508387356928595,-1
91,what kind of supplies do i need to use for my car,-0.674856901168823,0.508309187279042,-1
92,tell me the first payment of my bill,-0.637141823768616,0.507844898203694,-1
93,my card did not work correctly,-0.634016811847687,0.50780642732399,-1
94,do i need permission to travel there,-0.6035174727439880,0.507430956321996,-1
95,what's on the menu list,-0.596130311489105,0.507340013243466,-1
96,"can you order me more tea, please",-0.580981612205505,0.5071535166344480,-1
97,what did i list in my notes,-0.563179671764374,0.506934353262684,-1
98,i should text ruthie,-0.5272076129913330,0.506491485758602,-1
99,what kinds of things do you do for him,-0.5057280063629150,0.506227036170681,-1
100,how much is my water worth for,-0.504424810409546,0.506210991553151,-1
101,"order new fruit, please",-0.4993856549263,0.506148950630848,-1
102,i would like to know tomorrow's events,-0.481819748878479,0.505932681770984,-1
103,how much is my gas mask,-0.47501266002655,0.50584887328972,-1
104,how high in fat is pork,-0.466810196638107,0.505747884602228,-1
105,tell me something important about cats,-0.46397042274475100,0.505712921210787,-1
106,read my daily balances,-0.443742364645004,0.505463871084481,-1
107,i want to check the reservation for mercury at the ritz,-0.443453013896942,0.505460308545563,-1
108,my new debit card is late and i need to report it,-0.432978838682175,0.505331348229132,-1
109,cash for a bank of america travel rewards credit card,-0.427465885877609,0.505263471272748,-1
110,ai please no,-0.40367379784584,0.504970534497622,-1
111,can i borrow butter for margarine,-0.400484591722488,0.504931267576957,-1
112,"ai, show me online options to order more stuff for my usbank account",-0.400074869394302,0.504926222889462,-1
113,since we're out of commission i want help purchasing new ones,-0.392586827278137,0.504834026536487,-1
114,what's on the paper list,-0.385151267051697,0.504742476040299,-1
115,how much is my groceries and gas supplies,-0.37441474199295,0.504610281783651,-1
116,can you find the exact amount i pay income claim,-0.36909127235412600,0.504544735930907,-1
117,stop that please,-0.367919236421585,0.504530305078104,-1
118,the credit crunch on my account is how much,-0.36683905124664300,0.504517005143637,-1
119,set a guard to take out the trash,-0.36382383108139,0.504479879780315,-1
120,"if i ate a cookie, how many vitamins would i be ingesting",-0.356496512889862,0.504389660839911,-1
121,order more supplies,-0.350123971700668,0.504311197532707,-1
122,how long does it take pork to survive,-0.347286701202393,0.504276262950574,-1
123,how do i make you keep talking,-0.346393555402756,0.50426526586733,-1
124,temperatures should be set at 4,-0.33864238858223,0.504169827495928,-1
125,"i need to book a jet in ny, queens arrive on 8th and leave on the 13th",-0.32386714220047,0.503987902378934,-1
126,what's the amount of money i took yesterday,-0.293140590190887,0.503609568199914,-1
127,create an office for 6am,-0.290055274963379,0.503571578664325,-1
128,maybe tonight's dinner reservation,-0.282489836215973,0.503478425122766,-1
129,i would like to know what today's agenda is,-0.279810279607773,0.50344543157978,-1
130,what's a good sauce for chicken divan,-0.275982618331909,0.503398301302434,-1
131,i need to know today's events please,-0.237415000796318,0.502923412137051,-1
132,for how long does this need to happen,-0.216517239809036,0.502666092447852,-1
133,please look to see if paying bills is on my guests list currently,-0.213314339518547,0.502626654156486,-1
134,what's the amount of money i lost yesterday,-0.20703062415123,0.502549280751844,-1
135,does my car have enough acceleration to get to atlantic city,-0.206101670861244,0.502537842241305,-1
136,is there a question that you preferred to be called by,-0.20367406308651,0.502507950287598,-1
137,when is my visa check,-0.200728744268417,0.502471683559068,-1
138,list out what is on my blog list,-0.199860200285912,0.502460988871854,-1
139,never again,-0.199733138084412,0.502459424310135,-1
140,what's the matter,-0.196988165378571,0.502425624480986,-1
141,help me count $x from credit to debit,-0.178858399391174,0.502202385656039,-1
142,can you please accept that response,-0.175963014364243,0.502166733576047,-1
143,i need to return my bent card,-0.171880826354027,0.502116467859997,-1
144,what is my hourly rate for chase bank,-0.171294152736664,0.502109243894849,-1
145,i need you to announce my reservation for smith's at 6:15,-0.168663412332535,0.502076850443433,-1
146,might you have any questions,-0.168540343642235,0.502075335044665,-1
147,"i recently ran out of supplies, so i wanna get some new ones",-0.166513442993164,0.502050376922397,-1
148,how much is my credit worth,-0.16477145254612,0.502028927017023,-1
149,what's the amount of protein in an cream filled oatmeal cookie,-0.154622167348862,0.501903954195405,-1
150,do the shower curtainlist please,-0.15394002199173,0.50189555461684,-1
151,"ai, research usbank options to order more products",-0.151548251509666,0.501866103606717,-1
152,please inform me of the delayed payment of the bill,-0.150438159704208,0.501852434512714,-1
153,what is my current amount of knowledge,-0.149827033281326,0.501844909418128,-1
154,what apr does this credit award have,-0.144266724586487,0.501776442615685,-1
155,how near is imanas at 6,-0.141313478350639,0.50174007782207,-1
156,what kind of store does wendy's have,-0.140859395265579,0.501734486468961,-1
157,quickly grabbed the phone,-0.138835847377777,0.501709569502149,-1
158,will qdoba had reservations,-0.136840581893921,0.501685000782542,-1
159,tell me a little about dogs,-0.124627351760864,0.501534612889756,-1
160,what tactics should i use when talking with you,-0.120322212576866,0.501481601390877,-1
161,probably a reminder for me to do this in a bit,-0.120064698159695,0.501478430476013,-1
162,can you find me a course for pasta,-0.119890168309212,0.501476281395115,-1
163,"ai, keep talking",-0.117956221103668,0.501452467648539,-1
164,how can i find out about health insurance,-0.116102576255798,0.501429642702497,-1
165,can i borrow apple juice for wine,-0.11528392136097,0.501419562153707,-1
166,set an hour for lunch and another for dinner,-0.113987863063812,0.501403603071424,-1
167,do you know anything useful about cats,-0.112489007413387,0.501385146829659,-1
168,how much can i spend wth my inheritance,-0.106896638870239,0.501316284858077,-1
169,when will my payment for my credit card be processed,-0.104663319885731,0.501288784734274,-1
170,whats the culinary content of oatmeal,-0.10416118055582,0.50128260160672,-1
171,can you set a timetable for the meeting,-0.0953463837504387,0.501174059931153,-1
172,how long will the turkey take to survive,-0.0949079245328903,0.501168660927024,-1
173,what's the amount of vitamins in a cheesy omelette,-0.0936839953064919,0.501153589971018,-1
174,i wanna order some more coke for my checking account,-0.092814639210701,0.501142885079959,-1
175,do you have anything useful to tell me,-0.0909736007452011,0.501120215291018,-1
176,i need oranges on my shopping carts,-0.0851082280278206,0.501047991478338,-1
177,can i borrow milk for water,-0.0844847857952118,0.501040314661776,-1
178,is there somebody on my way to work today,-0.0831321328878403,0.501023658636973,-1
179,can i ask your name,-0.0830561593174934,0.501022723128864,-1
180,please stay,-0.0804973244667053,0.500991214657477,-1
181,can i borrow lemon juice for lime juice,-0.0802524015307427,0.500988198773751,-1
182,what was my last thought,-0.077665701508522,0.500956347173012,-1
183,use your voice now,-0.075163908302784,0.500925541073835,-1
184,what is your current assignment,-0.0747275277972221,0.500920167654913,-1
185,how many portions are in spaghetti and meat sauce,-0.0746896043419838,0.500919700680303,-1
186,what's waiting on the list,-0.0744711682200432,0.500917010943216,-1
187,i need a list of plans for a trip to paris,-0.0735434964299202,0.500905587954542,-1
188,how do i order food for my savings account,-0.0682523101568222,0.500840434332377,-1
189,how much is my current water consumption for,-0.0678989961743355,0.500836083759549,-1
190,set the clock at 4 for me please,-0.0665794834494591,0.500819835784984,-1
191,is pizza heaven,-0.0634795799851418,0.500781664753662,-1
192,what danger would i be in if i traveled to moscow,-0.0609243288636208,0.500750200357105,-1
193,what tactic should i use when talking with you,-0.0594432391226292,0.500731962775074,-1
194,how much am i going to have to pay in relation to the state,-0.0576680824160576,0.500710104160465,-1
195,please set the clock to 4,-0.0565021075308323,0.500695746781088,-1
196,what is my chase card's financial balance,-0.056364331394434,0.500694050257112,-1
197,please stay,-0.0542777627706528,0.50066835702709,-1
198,do i have any experience to look up how to properly do a potato in my microwave,-0.0538520477712154,0.500663114930475,-1
199,do you have any sodiumions for a meal from australia,-0.0530614778399468,0.500653380145161,-1
200,please choose the ai name for me,-0.0519783794879913,0.500640043272422,-1
201,how do you mean asian,-0.0508387088775635,0.500626009788821,-1
202,tell me my current patient list,-0.0501050129532814,0.500616975327264,-1
203,what do people find fascinating about food,-0.0499029792845249,0.500614487558959,-1
204,is spaghetti junction,-0.0493855774402618,0.500608116462771,-1
205,keep talking please,-0.04866411536931990,0.500599232643605,-1
206,when will my deadline for my credit card be processed,-0.047947458922863,0.500590407998761,-1
207,book me an entrance to olive garden,-0.047172438353300100,0.50058086467908,-1
208,what is my wells fargo card's financial balance,-0.04624833911657330,0.500569485658693,-1
209,i need to leave mark,-0.0453405901789665,0.500558307969342,-1
210,how much are working on this,-0.044017918407917,0.500542021070551,-1
211,you can join my reservation,-0.0434226021170616,0.5005346905620380,-1
212,can you list off different questions,-0.04304538667202,0.50053004566798,-1
213,show me the last month of february,-0.0412727743387222,0.50050821836197,-1
214,can you tell me the amount of hours i have,-0.0412472225725651,0.500507903726765,-1
215,could you check my account and let me know how much i save on food in january,-0.0410422123968601,0.500505379305612,-1
216,do i have a good deal on my credit card,-0.0402924418449402,0.500496146902003,-1
217,what are some wonderful things about food,-0.0380000732839108,0.500467919501934,-1
218,show me the last month of july,-0.0345954298973084,0.500425995945183,-1
219,how many peas are in a can of coke,-0.0338112451136112,0.500416339774327,-1
220,do you my dear,-0.0337779298424721,0.500415929541991,-1
221,what's the amount of vitamins in an cream filled oatmeal cookie,-0.0324770621955395,0.500399911122517,-1
222,10 minute drive,-0.0321967601776123,0.500396459583496,-1
223,i need to know what northern ireland is in,-0.0311779547482729,0.500383914376692,-1
224,what is my american express card's financial balance,-0.0308808982372284,0.500380256528639,-1
225,please confirm the next time i should get the warrant on my car replaced,-0.0301337875425816,0.500371056873516,-1
226,can you tell me the date my credit card is issued,-0.0283922888338566,0.500349612677426,-1
227,do you know how do i miss a meeting,-0.0280768927186728,0.50034572900163,-1
228,are there any sundays on the calendar for today,-0.027868676930666,0.500343165106311,-1
229,can you show me how to order some more champagne for my chase account,-0.0254834312945604,0.5003137940368,-1
230,everyone needs to be at 4,-0.025286577641964,0.500311370050581,-1
231,my starbucks coffee balance is,-0.025246649980545,0.5003108783954850,-1
232,would you accept that,-0.0248443428426981,0.500305924527699,-1
233,i would like to know the amount of experience i have,-0.0239244047552347,0.500294596735279,-1
234,you saved my ass how,-0.0234732404351234,0.500289041257212,-1
235,how do i act acquaintance,-0.0234108176082373,0.500288272604567,-1
236,let's move,-0.0226156692951918,0.500278481428931,-1
237,what is the hourly rate on my money market account,-0.0208563059568405,0.500256817249097,-1
238,i must know what kinds of abilities you have,-0.0206890180706978,0.500254757324998,-1
239,"i would like an excursion going to atlantic city, new jersey",-0.0206866916269064,0.500254728677989,-1
240,please switch to russian,-0.0206749755889177,0.500254584410824,-1
241,what is the mood in las vegas,-0.0203272849321365,0.500250303070529,-1
242,how do you like tomato,-0.0202776584774256,0.50024969198784,-1
243,"hello, may i get your message",-0.0198737308382988,0.500244718165098,-1
244,how do i place an order for more gold for my bank of america account,-0.0193022452294827,0.500237681092426,-1
245,i want you to repord my card as compensation,-0.0185101591050625,0.500227927622481,-1
246,give me the specifics on my federal agency,-0.0183049868792295,0.500225401203826,-1
247,can you go by a different spelling,-0.0171885974705219,0.500211654376949,-1
248,what is the matter today,-0.0167809575796127,0.500206634842497,-1
249,give me the details on my visit,-0.0167178101837635,0.5002058572676380,-1
250,can i ask your name please,-0.0160978697240353,0.5001982235384530,-1
251,can i please get a new outfit,-0.0145996157079935,0.500179774564102,-1
252,i need a vegi lasagna pizza,-0.0144983660429716,0.500178527811228,-1
253,what sort of job do you have,-0.0143553949892521,0.500176767315798,-1
254,can i borrow rice milk for milk,-0.0143365059047937,0.500176534722235,-1
255,list the leaders in pizza,-0.0142080429941416,0.5001749528749880,-1
256,how can i eat avocado,-0.0140735059976578,0.500173296233574,-1
257,please keep doing what i asked,-0.0140136918053031,0.500172559702576,-1
258,i need you to meet the broker,-0.0136120989918709,0.500167614629419,-1
259,i am needing to know what kind of abilities you have,-0.0133131761103868,0.5001639337978,-1
260,i want to know what kinds of abilities you have,-0.0128829926252365,0.50015863666907,-1
261,now use your voice,-0.0123060029000044,0.500151531819675,-1
262,"x has given me an hourly rate, what is it",-0.0121769402176142,0.500149942586997,-1
263,call an ambulance to mark's house,-0.0120370741933584,0.500148220325748,-1
264,i'd like to check the ai name,-0.0120042972266674,0.500147816721656,-1
265,"ai, research usbank options to order more drinks",-0.0117884436622262,0.500145158776435,-1
266,i need an suv that fits ten people to go to chipotle,-0.0117680467665195,0.500144907616202,-1
267,how do you feel friend,-0.0117009049281478,0.500144080855109,-1
268,i need more energy for my fifth third account,-0.0114599214866757,0.500141113469367,-1
269,how long do i keep the chicken roast,-0.0112810470163822,0.500138910871749,-1
270,when is the call due,-0.0108916461467743,0.500134115925718,-1
271,how much is my water anyway,-0.0102764638140798,0.500126540785717,-1
272,i need an empty set please,-0.010128865018487,0.500124723305782,-1
273,how many vitamins are in a can of coke,-0.0101153189316392,0.500124556504007,-1
274,how long do these last for,-0.00979400053620338,0.500120599901679,-1
275,texts from my phone please,-0.00961864925920963,0.500118440687384,-1
276,first stop,-0.009573669172823430,0.5001178868183310,-1
277,i want to know the advice that was given by the person who made you,-0.00934350304305553,0.500115052633102,-1
278,"find a chow mein container for me, please",-0.00917071662843227,0.500112925001614,-1
279,i need an eta to get to dulles airport,-0.00903727300465107,0.500111281823492,-1
280,i think we should hurry,-0.008962666615843770,0.500110363146506,-1
281,what kind of storm does my vehicle run on,-0.008485289290547370,0.500104484889022,-1
282,what is the total number of vitamins in a bag of potato chips,-0.00823452696204186,0.500101397089368,-1
283,what's the universe like right now,-0.00798119977116585,0.500098277706888,-1
284,i want you to read the ai name,-0.00746671995148063,0.500091942582196,-1
285,when can i put a pto notice in for feb 22 to march 1,-0.007446687668561940,0.500091695911665,-1
286,what is the status of the warrant for a credit card i put in,-0.006973880343139170,0.500085873927476,-1
287,call an ambulance to mcdonalds,-0.00692829117178917,0.500085312558349,-1
288,can you locate my address for me,-0.00654437905177474,0.500080585198637,-1
289,can you tell me what time this party is going to land,-0.00649823155254126,0.500080016954454,-1
290,i'd rather have you than be ray ray,-0.00637497426941991,0.500078499207331,-1
291,show me the clock on macys,-0.00620540510863066,0.500076411191923,-1
292,when should she be changed in my car,-0.006139645352959630,0.500075601449264,-1
293,disconnect from my office please,-0.00597412884235382,0.500073563336771,-1
294,at what point should the oil be vitamind again,-0.0059582362882793,0.500073367641411,-1
295,what type of complex numbers are in onions,-0.00566350808367133,0.500069738461249,-1
296,can you create a monster,-0.0054990709759295,0.500067713640139,-1
297,would i need a tourist attraction for brazil,-0.00536997197195888,0.500066123960094,-1
298,how many turns in chicken,-0.00533016631379724,0.500065633807122,-1
299,"i don't need my work, cancel it",-0.005292150191962720,0.500065165689876,-1
300,how else do i cook chicken breast,-0.00504091707989574,0.500062072093076,-1
301,would you tell me what kind of idea you have,-0.00450343545526266,0.50005545373205,-1
302,"disconnect from my office, please",-0.00443296041339636,0.500054585926994,-1
303,can you tell me how many bins are in cookies,-0.00435845274478197,0.5000536684655800,-1
304,please say my credit card's empty,-0.00429894402623177,0.500052935696,-1
305,where are modular forms given,-0.0042044213041663200,0.500051771776206,-1
306,how many recipes would i estimate for fettuccine alfredo,-0.00400224700570107,0.500049282272489,-1
307,what is my apr for my credit accounts,-0.00395328644663096,0.50004867938926,-1
308,please email me at a later time,-0.0037263133563101300,0.500045884521875,-1
