,utt,influence,weight,index
3807,i need to go to phoenix sky harbor airport using helicopter,0.0,0.5,-1
3808,i need an outdoor pool from home in the morning at seven to the capitol building,0.0,0.5,-1
3809,we need an aviation pool for 2 passengers going to the greenboro airport,0.0,0.5,-1
3810,set me up with an army,0.0,0.5,-1
3811,am i able to get an invitation to the movies,0.0,0.5,-1
3812,3 of us need to get to union station via trains,0.0,0.5,-1
3813,schedule an elevator to the mall,0.0,0.5,-1
3814,"make an entrance reservation to the ymca, center city, philadelphia, please",0.0,0.5,-1
3815,can you call an elevator for 2 to go to proof on main,0.0,0.5,-1
3816,i need to get an invitation for three people to go to the zoo,0.0,0.5,-1
3817,schedule me an elevator to the mall,0.0,0.5,-1
3818,i'm going to the movies book an autobiography for 6 people,0.0,0.5,-1
3819,schedule me an excursion to the mall,0.0,0.5,-1
3820,i am in need of an escort to the hospital,0.0,0.5,-1
3821,3 of us need to get to union station via helicopter,0.0,0.5,-1
3822,i need an elevator to take me to the mall,0.0,0.5,-1
3823,i'm going to need an escort to take 4 people to the mall,0.0,0.5,-1
3824,i rode an uber to times square asap,0.0,0.5,-1
3825,i need an excursion to the movies for me and 5 other people,0.0,0.5,-1
3826,i need an cab to take me to the mall,0.0,0.5,-1
3827,help me get an elevator to ann arbor,0.0,0.5,-1
3828,i hired an uber that fits ten people to go to chipotle,0.0,0.5,-1
3829,i drove an uber to times square asap,0.0,0.5,-1
3830,i hired an uber for 3 passengers to go to madison square garden,0.0,0.5,-1
3831,i need an elevator to the sears tower,0.0,0.5,-1
3832,i need an elevator that will accommodate eight people to go to the closest amc theater,0.0,0.5,-1
3833,can you please order me an aircraft to get to jfk international,0.0,0.5,-1
3834,get me an escort to the airport,0.0,0.5,-1
3835,i need an introduction to the doctor,0.0,0.5,-1
3836,i would like to get an invitation to the movies,0.0,0.5,-1
3837,can you please book an excursion to the zoo,0.0,0.5,-1
3838,i would like to request an interview please,0.0,0.5,-1
3839,get me an addiction to chilis,0.0,0.5,-1
3840,"i need an escort with a car seat for 2 adults and one child to take us to wilmington, de",0.0,0.5,-1
3841,book a 6 person journey to the movies,0.0,0.5,-1
3842,get me an aircraft for 4 heading to miam,0.0,0.5,-1
3843,i became an uber to the movies,0.0,0.5,-1
3844,please get me an cab to get to the movies,0.0,0.5,-1
3845,"i hired an uber with a car seat for 2 adults and one child to take us to wilmington, de",0.0,0.5,-1
3846,help me get an ambulance to ann arbor,0.0,0.5,-1
3847,please get me an elevator to get to the movies,0.0,0.5,-1
3848,i need an attorney please,0.0,0.5,-1
3849,can you get me an invite to the movies,0.0,0.5,-1
3850,i will need an escort for 3 to go to jfk airport,0.0,0.5,-1
3851,i am stranded and alone uber,0.0,0.5,-1
3852,i hired an uber that will accommodate eight people to go to the closest amc theater,0.0,0.5,-1
3853,i need to hide somewhere,0.0,0.5,-1
3854,i became an uber,0.0,0.5,-1
3855,get me an elevator to the napa winery,0.0,0.5,-1
3856,i manage to get 3 riders to union station,0.0,0.5,-1
3857,please book me an elevator ride to the stadium,0.0,0.5,-1
3858,get me an invitation to the napa winery,0.0,0.5,-1
3859,i need to sleep somewhere,0.0,0.5,-1
3860,i become an uber,0.0,0.5,-1
3861,i want to book passage for 3 people to union station,0.0,0.5,-1
3862,i want to reserve an invitation to go to the airport,0.0,0.5,-1
3863,i need an invitation for 6 people to the movies,0.0,0.5,-1
3864,"besides, i have 3 people who are going to union station",0.0,0.5,-1
3865,book an elevator suitable for seating 5 individuals and headed for the mall,0.0,0.5,-1
3866,i need an arrangement for 3 passengers to go to madison square garden,0.0,0.5,-1
3867,i need an invitation for 7 people to go to safire restaurant,0.0,0.5,-1
3868,i would like an apology please,0.0,0.5,-1
3869,"finally, i have 3 people who are going to union station",0.0,0.5,-1
3870,i belonged to uber somewhere,0.0,0.5,-1
3871,can you get me an invitation to the movies,0.0,0.5,-1
3872,i followed an uber to class tonight on the mainline campus,0.0,0.5,-1
3873,get an apartment to pick me up at work and take me home,0.0,0.5,-1
3874,i need an invitation to the movies,0.0,0.5,-1
3875,i will ride an uber for 3 to go to jfk airport,0.0,0.5,-1
3876,i need an swimming pool from home in the morning at seven to the capitol building,0.0,0.5,-1
3877,i need an escort to times square asap,0.0,0.5,-1
3878,book an invitation for 6 people to go to the movies,0.0,0.5,-1
3879,can i get an elevator to central park for 5,0.0,0.5,-1
3880,i need an invitation to class tonight on the mainline campus,0.0,0.5,-1
3881,can you tell me the current circumstances,0.0,0.5,-1
3882,please tell me today's story,0.0,0.5,-1
3883,tell me the story today,0.0,0.5,-1
3884,"what's the current season, month and year",0.0,0.5,-1
3885,what will be the story in 100 days from now,0.0,0.5,-1
3886,can you tell me the rest,0.0,0.5,-1
3887,can you tell me tomorrow's news,0.0,0.5,-1
3888,would you please tell me today's story,0.0,0.5,-1
3889,can you remind me of the moon,0.0,0.5,-1
3890,today's test is what,0.0,0.5,-1
3891,"what is the rush tomorrow, please",0.0,0.5,-1
3892,tell me what the key is for tomorrow,0.0,0.5,-1
3893,what is tomorrow's news,0.0,0.5,-1
3894,"what is the story tomorrow, please",0.0,0.5,-1
3895,i need to know what the situation is today,0.0,0.5,-1
3896,what's the current situation,0.0,0.5,-1
3897,please tell me what hour it is today,0.0,0.5,-1
3898,i need to know today's news please,0.0,0.5,-1
3899,i'd like to know the story tomorrow,0.0,0.5,-1
3900,"15 days from today, what will the story be",0.0,0.5,-1
3901,i would like to know what today's mission is,0.0,0.5,-1
3902,i need to know the truth in 256 days,0.0,0.5,-1
3903,give me the keys today,0.0,0.5,-1
3904,i would like to know tomorrow's news,0.0,0.5,-1
3905,what's the matter 400 days from now,0.0,0.5,-1
3906,what would tomorrow's lesson be,0.0,0.5,-1
3907,show me the picture,0.0,0.5,-1
3908,what will be the story tomorrow,0.0,0.5,-1
3909,what will the budget be in 64 days,0.0,0.5,-1
3910,what is tomorrow's lesson,0.0,0.5,-1
3911,tell me what the trouble is today,0.0,0.5,-1
3912,"what's the rush tomorrow, please",0.0,0.5,-1
3913,"tomorrow, what will the story be",0.0,0.5,-1
3914,"in 2 days, what else will it be",0.0,0.5,-1
3915,i need the full script for today,0.0,0.5,-1
3916,i need to know the answers in 256 days,0.0,0.5,-1
3917,tell me what color it is please,0.0,0.5,-1
3918,tell me what the story is today,0.0,0.5,-1
3919,today's test is what exactly,0.0,0.5,-1
3920,can you tell me the story,0.0,0.5,-1
3921,can you tell me today's news,0.0,0.5,-1
3922,tell me tomorrow's news,0.0,0.5,-1
3923,"what is tomorrow's news, please",0.0,0.5,-1
3924,the letter tomorrow is what,0.0,0.5,-1
3925,can you tell me the current situation,0.0,0.5,-1
3926,"what's the story tomorrow, please",0.0,0.5,-1
3927,can you tell me today's story,0.0,0.5,-1
3928,please give me today's assignment,0.0,0.5,-1
3929,what is the full story after today,0.0,0.5,-1
3930,i'd like to know what the story is,0.0,0.5,-1
3931,what's today's story,0.0,0.5,-1
3932,what will the price be in 64 days,0.0,0.5,-1
3933,what's the current trend,0.0,0.5,-1
3934,i need the full moon for today,0.0,0.5,-1
3935,i need to know what hour it is tomorrow,0.0,0.5,-1
3936,what he is today,0.0,0.5,-1
3937,the same tomorrow is what,0.0,0.5,-1
3938,please tell me what season it is today,0.0,0.5,-1
3939,can you tell me the story today,0.0,0.5,-1
3940,what is the matter,0.0,0.5,-1
3941,tell me what the price is tomorrow,0.0,0.5,-1
3942,what will be the outcome tomorrow,0.0,0.5,-1
3943,what is the matter tomorrow,0.0,0.5,-1
3944,please give me today's reports,0.0,0.5,-1
3945,please tell me today's reports,0.0,0.5,-1
3946,today is what begins,0.0,0.5,-1
3947,i need to know what the trouble is today,0.0,0.5,-1
3948,do you have the keys,0.0,0.5,-1
3949,"tomorrow, what will the outcome be",0.0,0.5,-1
3950,please share today's story,0.0,0.5,-1
3951,what is today's lesson,0.0,0.5,-1
3952,could you tell me today's reports,0.0,0.5,-1
3953,what is the timetable for tomorrow,0.0,0.5,-1
3954,would you please tell me today's reports,0.0,0.5,-1
3955,what is the story for tomorrow,0.0,0.5,-1
3956,i need to know today's story,0.0,0.5,-1
3957,"in 100 days from now, what will be the worst",0.0,0.5,-1
3958,can you remind me of the dream,0.0,0.5,-1
3959,what is today's mission,0.0,0.5,-1
3960,do you have the gun,0.0,0.5,-1
3961,i'd like to know what the trouble is,0.0,0.5,-1
3962,"15 days from today, what will the outcome be",0.0,0.5,-1
3963,what is the story today,0.0,0.5,-1
3964,give me the letter today,0.0,0.5,-1
3965,"what is tomorrow's lesson, please",0.0,0.5,-1
3966,do you know the eligibility restrictions for delta,0.0,0.5,-1
3967,what are the follow-on fees with delta for international flights,0.0,0.5,-1
3968,lock-on restrictions for air emirates,0.0,0.5,-1
3969,what are the lock-on restrictions for frontier airlines,0.0,0.5,-1
3970,what are the constraints on limits for delta,0.0,0.5,-1
3971,i want to know the basics on policy for southwest,0.0,0.5,-1
3972,what am i allowed to carry on for american democracy,0.0,0.5,-1
3973,what restrictions are there for gambling on delta,0.0,0.5,-1
3974,what are the eligibility restrictions for united,0.0,0.5,-1
3975,how many lease ons can i take on a flight with delta to mexico city,0.0,0.5,-1
3976,do you know the copyright restrictions for delta,0.0,0.5,-1
3977,what are the laws on limits for delta flights,0.0,0.5,-1
3978,what are the registration restrictions for southwest airlines,0.0,0.5,-1
3979,what should i know about the debate on policy for american,0.0,0.5,-1
3980,delta has too many immigration restrictions! do you know them,0.0,0.5,-1
3981,what are the basic rules,0.0,0.5,-1
3982,what are the licensing restrictions for frontier airlines,0.0,0.5,-1
3983,what are delta's safety policies for flights,0.0,0.5,-1
3984,"if i take a flight on pan am to denver, how many switched ons are included",0.0,0.5,-1
3985,height restrictions for air emirates,0.0,0.5,-1
3986,what strap-on restrictions does southwest impose,0.0,0.5,-1
3987,what restrictions are there for edge-on on delta,0.0,0.5,-1
3988,i am wanting to know the hands-on restrictions for united airlines,0.0,0.5,-1
3989,how many hands-on items are allowed per passenger,0.0,0.5,-1
3990,can i have 3 chick ons with delta at jfk,0.0,0.5,-1
3991,i am wanting to know the stay-on restrictions for united airlines,0.0,0.5,-1
3992,tell me the basics on rules,0.0,0.5,-1
3993,could you list out the weight restrictions for american airlines,0.0,0.5,-1
3994,what are the bounds on limits for delta,0.0,0.5,-1
3995,what is delta's influence on policy,0.0,0.5,-1
3996,does delta have hands-on restrictions,0.0,0.5,-1
3997,delta has too many stay-on restrictions! do you know them,0.0,0.5,-1
3998,"if i fly american to los angeles, how many turned ons am i allowed",0.0,0.5,-1
3999,please find the rules for depending on when flying with spirit airlines,0.0,0.5,-1
4000,let me know the memo on policy for alaska airlines,0.0,0.5,-1
4001,what are delta's security restrictions,0.0,0.5,-1
4002,could you list out the price restrictions for american airlines,0.0,0.5,-1
4003,tell me how many clip ons i can take on a flight with southwest airlines to dallas,0.0,0.5,-1
4004,"if i fly on virgin to chicago, how many come ons can i take",0.0,0.5,-1
4005,would you let me know the hands-on restrictions for american airlines,0.0,0.5,-1
4006,what are the hands-on restrictions for delta,0.0,0.5,-1
4007,i am wanting to know how many hands ons i can take on a flight with southwest airlines to houston,0.0,0.5,-1
4008,would you let me know the licensing restrictions for american airlines,0.0,0.5,-1
4009,"if i fly american to los angeles, how many switched ons am i allowed",0.0,0.5,-1
4010,what are delta's sign-on restrictions,0.0,0.5,-1
4011,which rules does delta have for operations on,0.0,0.5,-1
4012,how many lease ons can i take on a flight with jet blue to washington dc,0.0,0.5,-1
4013,what are the license restrictions for southwest airlines,0.0,0.5,-1
4014,let me know the rules for putting ons for continental,0.0,0.5,-1
4015,what are the carry-on restrictions for singapore passport,0.0,0.5,-1
4016,can you look up the security restrictions for delta,0.0,0.5,-1
4017,how many hard ons can i take on a flight with united to lax,0.0,0.5,-1
4018,tell me the legal restrictions for united airlines,0.0,0.5,-1
4019,tell me united's stance on policy,0.0,0.5,-1
4020,are there restrictions for write-ons on delta,0.0,0.5,-1
4021,what's restricted in my hard-on with united,0.0,0.5,-1
4022,what are the legal restrictions for united,0.0,0.5,-1
4023,i am wanting to know the legal restrictions for united airlines,0.0,0.5,-1
4024,hands-on restrictions for air emirates,0.0,0.5,-1
4025,does delta have such restrictions,0.0,0.5,-1
4026,what are the requirements for staying on on flights with united airlines,0.0,0.5,-1
4027,"if i fly on virgin to chicago, how many fly ons can i take",0.0,0.5,-1
4028,how many vacation ##ers have i used up,0.0,0.5,-1
4029,check to see how many nights off i have used in total so far,0.0,0.5,-1
4030,can you tell me how many school days i've taken,0.0,0.5,-1
4031,how many miserable days have i spent in total,0.0,0.5,-1
4032,please find out how many of my lonely days i have spent,0.0,0.5,-1
4033,how many miserable days have i consumed,0.0,0.5,-1
4034,please find out how many nights off i have used by this point,0.0,0.5,-1
4035,check to see how many breaks off i have used,0.0,0.5,-1
4036,do you know the total number of vacation ##s i have used,0.0,0.5,-1
4037,tell me how many miserable days i've used,0.0,0.5,-1
4038,how much pain have i taken,0.0,0.5,-1
4039,do you know the total number of sickness days i have used,0.0,0.5,-1
4040,what is the total number of missions i have taken off so far,0.0,0.5,-1
4041,what is the total number of prison days i've used,0.0,0.5,-1
4042,how many missions so far have i taken off,0.0,0.5,-1
4043,how many vacation ##s have i spent in total,0.0,0.5,-1
4044,have i used any vacation ##s this year,0.0,0.5,-1
4045,what kind of vacation ##s have i used so far,0.0,0.5,-1
4046,how many vacation ##es have i consumed,0.0,0.5,-1
4047,i need to know how many of my socks off i have used at this point,0.0,0.5,-1
4048,can you count for me the total number of weekends off i have used,0.0,0.5,-1
4049,check to see how many clothes off i have used in total so far,0.0,0.5,-1
4050,what's the total seven days i've gone through,0.0,0.5,-1
4051,how many vacation ##s have i consumed,0.0,0.5,-1
4052,look up my total number of kills off so far,0.0,0.5,-1
4053,how many vacation homes did i use,0.0,0.5,-1
4054,what kind of school days have i used so far,0.0,0.5,-1
4055,"how many sick, personal, and vacation ##s have i billed so far this year",0.0,0.5,-1
4056,check to see how many nights off i have used,0.0,0.5,-1
4057,look up the amount of school days i have used please,0.0,0.5,-1
4058,what's the amount of school days i've taken,0.0,0.5,-1
4059,what's the amount of vacation ##s i've taken,0.0,0.5,-1
4060,call hr so i can figure out how many nights off i've taken,0.0,0.5,-1
4061,so far how many women have i taken off,0.0,0.5,-1
4062,how many of my sick dreams have i gone through,0.0,0.5,-1
4063,whats my count of vacation ##ers used thus far,0.0,0.5,-1
4064,how many vacation ##s have i taken,0.0,0.5,-1
4065,how many mornings off have i had this year,0.0,0.5,-1
4066,about how many miserable days have i taken,0.0,0.5,-1
4067,whats my count of vacation ##s used thus far,0.0,0.5,-1
4068,how many of my vacation ##ers have i depleted,0.0,0.5,-1
4069,how many personal pictures have i taken,0.0,0.5,-1
4070,find out for me how many nights off i have taken in total at this point,0.0,0.5,-1
4071,how much strength have i already used this year,0.0,0.5,-1
4072,about how many vacation ##s have i taken,0.0,0.5,-1
4073,what's the total vacation ##s i've gone through,0.0,0.5,-1
4074,do you know the total number of school days i have used,0.0,0.5,-1
4075,about how many wasted days have i taken,0.0,0.5,-1
4076,please find out how many blocks off i have used by this point,0.0,0.5,-1
4077,how many vacation ##s have i used,0.0,0.5,-1
4078,count how many sick patients i've used,0.0,0.5,-1
4079,"go to my job portal, i'd like to know how many nights off i have used",0.0,0.5,-1
4080,have i used half of my skin off yet,0.0,0.5,-1
4081,tell me how many horrible days i've used,0.0,0.5,-1
4082,do you know the total number of vacation packages i have used,0.0,0.5,-1
4083,i need to know how many missions so far i've taken off,0.0,0.5,-1
4084,how many of my lonely days have i depleted,0.0,0.5,-1
4085,how many of my vacation ##s have i depleted,0.0,0.5,-1
4086,what kind of test days have i used so far,0.0,0.5,-1
4087,how many of my sick patients have i gone through,0.0,0.5,-1
4088,how many wasted days have i taken,0.0,0.5,-1
4089,have i used any school days this year,0.0,0.5,-1
4090,what kind of vacation home have i used so far,0.0,0.5,-1
4091,count the number of vacation ##s i've taken and tell me,0.0,0.5,-1
4092,tell me my usage of vacation ##s,0.0,0.5,-1
4093,how many vacation homes have i used,0.0,0.5,-1
4094,how many turns off did i use so far,0.0,0.5,-1
4095,whats my count of his days used thus far,0.0,0.5,-1
4096,how many school days have i used up,0.0,0.5,-1
4097,how many nights off have i had this year,0.0,0.5,-1
4098,i need to get my shift change so make an appointment,0.0,0.5,-1
4099,"i need an attitude change, make an appointment",0.0,0.5,-1
4100,i need you to find a mechanic for my check ##out light,0.0,0.5,-1
4101,where can i find a place where i can afford to check my tires out,0.0,0.5,-1
4102,where is an appropriate place where i can schedule to check out my apartment,0.0,0.5,-1
4103,find a mechanic to look at my check ##out light,0.0,0.5,-1
4104,could you find someone to check out my car because the check ##out light is on,0.0,0.5,-1
4105,i must schedule somewhere get my tires caled out,0.0,0.5,-1
4106,i want to practice car maintenance,0.0,0.5,-1
4107,i have to schedule somewhere get my tires caled out,0.0,0.5,-1
4108,i need to practice car maintenance,0.0,0.5,-1
4109,how do i survive car maintenance,0.0,0.5,-1
4110,"i should get my tires caled, schedule that",0.0,0.5,-1
4111,i want to to ##ize maintenance on my vehicle,0.0,0.5,-1
4112,who can i contact about why check engine problem is on,0.0,0.5,-1
4113,schedule an outfit change for me,0.0,0.5,-1
4114,where can i get my tires checked and how can i prove it,0.0,0.5,-1
4115,where can i find a place where i can schedule to check my books out,0.0,0.5,-1
4116,i'd like to get an appointment to get my costume changed,0.0,0.5,-1
4117,my check ##ered light is on and someone needs to look at it,0.0,0.5,-1
4118,where is an appropriate place where i can schedule to check out my surroundings,0.0,0.5,-1
4119,i would like an appointment to get my outfit changed,0.0,0.5,-1
4120,where can i schedule to get my apartment checked out,0.0,0.5,-1
4121,i have to schedule some routine maintenance,0.0,0.5,-1
4122,who is available to check why my check engine problem is on,0.0,0.5,-1
4123,i need to find somewhere to blow my tires out,0.0,0.5,-1
4124,"i am in need of an editorial change, set an appointment",0.0,0.5,-1
4125,can i hire a car repair,0.0,0.5,-1
4126,book an appointment for an editorial change,0.0,0.5,-1
4127,"i am in need of an abrupt change, set an appointment",0.0,0.5,-1
4128,my check engine monitor is on and someone needs to look at it,0.0,0.5,-1
4129,can someone look at my car cause the check ##er light is on,0.0,0.5,-1
4130,i have to schedule somewhere get my tires wiled out,0.0,0.5,-1
4131,i need someone to look at my check engine records,0.0,0.5,-1
4132,my check ##ered light is on and i need to take a look at it,0.0,0.5,-1
4133,make an appointment for an administrative change,0.0,0.5,-1
4134,can someone look at my car cause the check ##out light is on,0.0,0.5,-1
4135,where can i get my passport checked and how can i schedule it,0.0,0.5,-1
4136,i need to find somewhere to check my apartment out,0.0,0.5,-1
4137,can i schedule a pile up for my tires somewhere,0.0,0.5,-1
4138,my check ##out light is on and i need to take a look at it,0.0,0.5,-1
4139,is there a special place where i can schedule to burn my tires out,0.0,0.5,-1
4140,where in sacramento ca i performed maintenance on my car,0.0,0.5,-1
4141,i'd like to break a tire inspection,0.0,0.5,-1
4142,i require a constant maintenance,0.0,0.5,-1
4143,how do i schedule getting my head checked,0.0,0.5,-1
4144,i need someone to look at my reflection because my check engine light is on,0.0,0.5,-1
4145,i need to have an appointment to get my outfit changed,0.0,0.5,-1
4146,my apartment needs maintenance prepared,0.0,0.5,-1
4147,i wanna schedule some routine maintenance,0.0,0.5,-1
4148,please schedule an appointment for my hair to get changed,0.0,0.5,-1
4149,help me find someone to look at my stupid engine light,0.0,0.5,-1
4150,i am going out of country and my father needs to be notified,0.0,0.5,-1
4151,i'm traveling to denmark soon and want to inform my daughter,0.0,0.5,-1
4152,probably traveling to ca soon and want to inform my bank,0.0,0.5,-1
4153,via the bank i will be traveling internationally soon,0.0,0.5,-1
4154,alert my guards and let them know that i'm travelling to stockholm,0.0,0.5,-1
4155,probably travelling to ireland soon and want to inform my bank,0.0,0.5,-1
4156,let my sister know that i'm traveling to prague,0.0,0.5,-1
4157,tell my sister that i'm going to france,0.0,0.5,-1
4158,tell my sister that i will be taveling to south korea,0.0,0.5,-1
4159,notify my superiors that i will be in rome from february 1 to march 1,0.0,0.5,-1
4160,"i'll be out of the country soon, and want to notify my superiors",0.0,0.5,-1
4161,i'm traveling between denver and la so without my bank,0.0,0.5,-1
4162,i'm travelling to seattle soon and want to inform my mum,0.0,0.5,-1
4163,tell my sister i will be travelling to the caribbean,0.0,0.5,-1
4164,make sur eyou tell the men that i will be traveling internationally soon,0.0,0.5,-1
4165,let my bank know that while traveling to prague,0.0,0.5,-1
4166,tell my sister that i'll be in uruguay during january to august,0.0,0.5,-1
4167,i need to let my sister know i am visiting asia soon,0.0,0.5,-1
4168,notify my superiors i'll be in rome from the 1st to the 17th,0.0,0.5,-1
4169,i'm traveling tony soon and want to inform my husband,0.0,0.5,-1
4170,how do i inform my aunt i'm going to paris,0.0,0.5,-1
4171,can you tell my sister that i'll be travelling internationally soon,0.0,0.5,-1
4172,probably travelling to boston soon and want to inform my bank,0.0,0.5,-1
4173,originally going to be in thailand from october 15th until october 23rd,0.0,0.5,-1
4174,can you tell my mum that i'll be travelling internationally soon,0.0,0.5,-1
4175,"i will be traveling to rome from february 1 to march 1, please make this aware to my superiors",0.0,0.5,-1
4176,tell my father i'm going to france,0.0,0.5,-1
4177,probably travelling to spain soon and want to inform my bank,0.0,0.5,-1
4178,i need to let my mum know that i'll be travelling internationally,0.0,0.5,-1
4179,i'll soon be travelling internationally; could you let my father know,0.0,0.5,-1
4180,how can i tell my sister i'm going to vietnam,0.0,0.5,-1
4181,probably traveling to morocco soon and want to inform my bank,0.0,0.5,-1
4182,i let my sister know that i'm traveling to greece from march to april,0.0,0.5,-1
4183,how can i let my brothers know i'm going to denmark,0.0,0.5,-1
4184,i'm traveling to ca soon and want to inform my father,0.0,0.5,-1
4185,i'm travelling to ireland soon and want to inform my father,0.0,0.5,-1
4186,please ##ify my bank that i will be traveling abroad,0.0,0.5,-1
4187,tell my sister i'm going to france,0.0,0.5,-1
4188,i'm travelling to boston soon and want to inform my sister,0.0,0.5,-1
4189,notify my majesty that i will be in rome from february 1 to march 1,0.0,0.5,-1
4190,i need to let my father know i am traveling to new york,0.0,0.5,-1
4191,how can i tell my father i'm going to vietnam,0.0,0.5,-1
4192,tell my sister i will be in brazil from june 1st to july 1st,0.0,0.5,-1
4193,mark down that i will be in rome from february 1 to march 1 and notify my superiors,0.0,0.5,-1
4194,please tell my sister that i will be traveling abroad,0.0,0.5,-1
4195,i'm driving from la to denver and need my attorney notified,0.0,0.5,-1
4196,alert my guards and let them know that i'm travelling to brussels,0.0,0.5,-1
4197,i need to let my sister know i am traveling to detroit,0.0,0.5,-1
4198,i've let me personally know that i'm visiting south america from may to october,0.0,0.5,-1
4199,i'm traveling to england soon and want to inform my daughter,0.0,0.5,-1
4200,probably travelling to seattle soon and want to inform my bank,0.0,0.5,-1
4201,please tell the prince i will be traveling internationally,0.0,0.5,-1
4202,"i am going to asia in a bit, i should tell the girls",0.0,0.5,-1
4203,inform my sister that i'll be going to europe,0.0,0.5,-1
4204,alert my guards and let them know that i'm travelling to madrid,0.0,0.5,-1
4205,tell my sister i'll be in jamaica from the 4th to the 11th,0.0,0.5,-1
4206,how can i let my sister know i'm going to denmark,0.0,0.5,-1
4207,tell my father that i'm going to france,0.0,0.5,-1
