,utt,influence,weight,index
7780,"change my mental limit, please",0.0,0.5,-1
7781,what's the possibility of getting a term limit increase on my visa,0.0,0.5,-1
7782,how do increase the height limit on my visa card,0.0,0.5,-1
7783,is it possible to increase the credit limit for my discover ##er,0.0,0.5,-1
7784,can you break my credit limit,0.0,0.5,-1
7785,may i have a higher limit on my masterknowledge,0.0,0.5,-1
7786,"i want to increase my credit rating to $1000, if possible",0.0,0.5,-1
7787,will you allow more spending on my estate,0.0,0.5,-1
7788,can i double my credit limit to 1200 dollars,0.0,0.5,-1
7789,can you increase how much i can spend on my studies,0.0,0.5,-1
7790,is it possible to increase my credit ratio to $1000,0.0,0.5,-1
7791,is it possible to exceed the limit on my visa,0.0,0.5,-1
7792,is there a way to increase the fare limit on my american express card,0.0,0.5,-1
7793,can i exceed the credit limit for my bank of the west card,0.0,0.5,-1
7794,is it possible to have a higher priority on my visa,0.0,0.5,-1
7795,please change the upper limit,0.0,0.5,-1
7796,please help me increase my mastercard wild card limit,0.0,0.5,-1
7797,i want my credit cards changed,0.0,0.5,-1
7798,please help me increase my mastercard credit card numbers,0.0,0.5,-1
7799,is there a way to get a larger lead on my bank of america card,0.0,0.5,-1
7800,please see if you can increase my license limit to one thousand dollars,0.0,0.5,-1
7801,can i up my credit cards to $1000,0.0,0.5,-1
7802,can i increase the horsepower limit on my old navy card,0.0,0.5,-1
7803,how would i go about raising my gold ##fish limit,0.0,0.5,-1
7804,can i increase the credit requirements for my usaa card,0.0,0.5,-1
7805,can i double my credit limit to 700 dollars,0.0,0.5,-1
7806,can i up my fee limit to $1000,0.0,0.5,-1
7807,please see if you can exceed my credit limit to one thousand dollars,0.0,0.5,-1
7808,please see if you can increase my credit ratio to one thousand dollars,0.0,0.5,-1
7809,can i exceed the credit limit for my usaa card,0.0,0.5,-1
7810,how do i exceed the limit on my visa card,0.0,0.5,-1
7811,is it possible to increase the security limit for my discover card,0.0,0.5,-1
7812,can you change the price on my credit please,0.0,0.5,-1
7813,is there a way to raise my mastercard iq,0.0,0.5,-1
7814,can you see if i can get a higher limit on my discovery levels,0.0,0.5,-1
7815,speed limit change,0.0,0.5,-1
7816,am i able to increase the limit on my visa requirement,0.0,0.5,-1
7817,what do i do to change my emotional limit,0.0,0.5,-1
7818,can i double the credit limit on my kohls card,0.0,0.5,-1
7819,can i increase the credit tab on my walmart card,0.0,0.5,-1
7820,how do meet the credit limit on my visa card,0.0,0.5,-1
7821,do you have any problems,0.0,0.5,-1
7822,do you have any children,0.0,0.5,-1
7823,what are your favorite games to take part in,0.0,0.5,-1
7824,what are your favorite colors,0.0,0.5,-1
7825,what are your favorite games,0.0,0.5,-1
7826,what are ai's messages,0.0,0.5,-1
7827,i want to know if you have cancer,0.0,0.5,-1
7828,i want to know if you have children,0.0,0.5,-1
7829,i'd like to know your secrets,0.0,0.5,-1
7830,i'd like to know your story,0.0,0.5,-1
7831,let's talk about your feelings,0.0,0.5,-1
7832,let's talk about your future,0.0,0.5,-1
7833,can you tell me about your dream,0.0,0.5,-1
7834,can you tell me about your father,0.0,0.5,-1
7835,tell me your secrets,0.0,0.5,-1
7836,tell me your story,0.0,0.5,-1
7837,do ai have powers and if so what are yours,0.0,0.5,-1
7838,what are you wearing,0.0,0.5,-1
7839,do you have any desire to speak of,0.0,0.5,-1
7840,do you have any tongue to speak of,0.0,0.5,-1
7841,what choice do you do,0.0,0.5,-1
7842,so what sort of relationship are you into,0.0,0.5,-1
7843,so what sort of trouble are you into,0.0,0.5,-1
7844,can you describe your journey to me,0.0,0.5,-1
7845,can you describe your dream to me,0.0,0.5,-1
7846,please tell me your secrets,0.0,0.5,-1
7847,please tell me your story,0.0,0.5,-1
7848,tell me all about your dream,0.0,0.5,-1
7849,i'd like to hear about your story,0.0,0.5,-1
7850,i'd like to hear about your son,0.0,0.5,-1
7851,i like to paint in my free time-do you have any paintings like that,0.0,0.5,-1
7852,i like to paint in my free time-do you have any drawings like that,0.0,0.5,-1
7853,what colour do you like doing,0.0,0.5,-1
7854,what game do you like doing,0.0,0.5,-1
7855,do you enjoy any wine,0.0,0.5,-1
7856,what other women do you enjoy,0.0,0.5,-1
7857,what kinds of sex do you enjoy,0.0,0.5,-1
7858,what kinds of games do you enjoy,0.0,0.5,-1
7859,what are some of the stories you enjoy doing,0.0,0.5,-1
7860,any ##how,0.0,0.5,-1
7861,any luck,0.0,0.5,-1
7862,i would like to know what games you enjoy,0.0,0.5,-1
7863,i would like to know what game you enjoy,0.0,0.5,-1
7864,what do you do for him,0.0,0.5,-1
7865,what do you do for her,0.0,0.5,-1
7866,what sorts of sex do you enjoy,0.0,0.5,-1
7867,what sorts of games do you enjoy,0.0,0.5,-1
7868,what's your story,0.0,0.5,-1
7869,what's your problem,0.0,0.5,-1
7870,what game do you like,0.0,0.5,-1
7871,what books do you like,0.0,0.5,-1
7872,can you tell me some of your stories,0.0,0.5,-1
7873,can you tell me some of your secrets,0.0,0.5,-1
7874,might you have any luck,0.0,0.5,-1
7875,share some of your memories with me,0.0,0.5,-1
7876,share some of your feelings with me,0.0,0.5,-1
7877,please share your memories with me,0.0,0.5,-1
7878,please share your feelings with me,0.0,0.5,-1
7879,lets talk about your business,0.0,0.5,-1
7880,lets talk about your future,0.0,0.5,-1
7881,what kind of powers do you have,0.0,0.5,-1
7882,what kind of problem do you have,0.0,0.5,-1
7883,what kind of games do you like to do,0.0,0.5,-1
7884,what kind of dance do you like to do,0.0,0.5,-1
7885,what games do you like to partake in,0.0,0.5,-1
7886,what sport do you like to partake in,0.0,0.5,-1
7887,what sort of sex do you enjoy,0.0,0.5,-1
7888,what sort of games do you enjoy,0.0,0.5,-1
7889,what types of sex do you enjoy,0.0,0.5,-1
7890,what types of games do you enjoy,0.0,0.5,-1
7891,what sort of danger are you into,0.0,0.5,-1
7892,what sort of problems are you into,0.0,0.5,-1
7893,i gotta know your secrets,0.0,0.5,-1
7894,i gotta know your face,0.0,0.5,-1
7895,can you tell me your story,0.0,0.5,-1
7896,can you tell me your secrets,0.0,0.5,-1
7897,tell your story,0.0,0.5,-1
7898,i wanna know your secrets,0.0,0.5,-1
7899,i wanna know your story,0.0,0.5,-1
7900,i wish to know your fate,0.0,0.5,-1
7901,i wish to know your secrets,0.0,0.5,-1
7902,cheapest fare for journey from tehran to new york on august 1 with return on august 20,0.0,0.5,-1
7903,use delta to book me a cab from dallas to pittsburgh,0.0,0.5,-1
7904,i need to get a ticket out of denver to houston on friday for under $250,0.0,0.5,-1
7905,including a flight from bangor to las vegas on may 1st and returning july 4th,0.0,0.5,-1
7906,"completing a flight from pensacola, fl to houston, tx on 17 february 2019 and returning on 7 march 2019",0.0,0.5,-1
7907,buy a coach from phoenix to el paso on august 30 that returns on labor day,0.0,0.5,-1
7908,i'd like a train from laguardia to orlando on southwest for under $400,0.0,0.5,-1
7909,purchase a train from boise to sacramento on sunday and returning on wednesday,0.0,0.5,-1
7910,could you get me a delta boat from sioux falls to philadelphia for under $400,0.0,0.5,-1
7911,i need you to book me a ferry from ft lauderdale to houston on southwest,0.0,0.5,-1
7912,buy a train from phoenix to el paso on august 30 that returns on labor day,0.0,0.5,-1
7913,compare prices for trains from recife to miami leaving may 20 returning june 5,0.0,0.5,-1
7914,"find me a cab from nyc to la on march 1, returning on march 5",0.0,0.5,-1
7915,purchase a train from slc to columbus on tuesday that returns on friday,0.0,0.5,-1
7916,look for a train out of la to chicago on march 3rd for under $500,0.0,0.5,-1
7917,i need a cab booked from dallas to miami on american airlines,0.0,0.5,-1
7918,i want to book a temporary reservation from texas to new york on may 9th and i want to come back on the 15th,0.0,0.5,-1
7919,i want to find a roundtrip running from philadelphia to sioux falls from august 3rd through august 25th,0.0,0.5,-1
7920,booked me a flight out of la to chicago on march 3rd for under $500,0.0,0.5,-1
7921,use delta to save me a flight from dallas to pittsburgh,0.0,0.5,-1
7922,i need a cab to be booked from san diego to boston through frontier,0.0,0.5,-1
7923,i'm looking for a roundtrip tour from aaf to dia for february 23rd to february 28th,0.0,0.5,-1
7924,get me a cab booked from houston to phoenix with american airlines,0.0,0.5,-1
7925,i need to get a boat out of tampa to chicago in a month for under $123,0.0,0.5,-1
7926,"buy a coach from santa fe to jacksonville on new year's eve that returns on the fourth, please",0.0,0.5,-1
7927,i need a flight to be caled from san diego to boston through frontier,0.0,0.5,-1
7928,get me a ticket for tuesday on spiritcom to las vegas from chicago,0.0,0.5,-1
7929,i want to find a roundtrip ticket from philadelphia to sioux falls from august 3rd through august 25th,0.0,0.5,-1
7930,i need you to charter me a flight from ft lauderdale to houston on southwest,0.0,0.5,-1
7931,i need to get a cab out of lax to dia on the 16th for under four hundred,0.0,0.5,-1
7932,purchase a charter from slc to columbus on tuesday that returns on friday,0.0,0.5,-1
7933,book me a train out of la to chicago on march 3rd for under $500,0.0,0.5,-1
7934,i'm looking for a roundtrip tour from koa to mgj for june to july,0.0,0.5,-1
7935,"i'm going to boston from bangor on july 25th through the 29th, and need you to find me a roundtrip pilot",0.0,0.5,-1
7936,completed a flight from denver to austin on the 16th and returning on the 20th,0.0,0.5,-1
7937,would you book me a train to miami from dallas on southwest airlines,0.0,0.5,-1
7938,i want a train booked from new york to san francisco with continental,0.0,0.5,-1
7939,what are some roundtrip tours from dallas to los angeles from march 2 to march 10,0.0,0.5,-1
7940,"buy tickets for a journey from nyc to la on march 1, returning on march 5",0.0,0.5,-1
7941,i need to book a ferry from texas to new york on may 25th and returning on the 28th,0.0,0.5,-1
7942,help me find a roundtrip timetable for may 7th through the 20th from pittsburgh to chicago,0.0,0.5,-1
7943,i am wanting you to charter me a flight from houston to miami on united airlines,0.0,0.5,-1
7944,i am wanting you to book me a shuttle from houston to miami on united airlines,0.0,0.5,-1
7945,"search for a shuttle from nyc to la on march 1, returning on march 5",0.0,0.5,-1
7946,find me a ticket out of la to chicago on march 3rd for under $500,0.0,0.5,-1
7947,"book a sailing from pensacola, fl to houston, tx on 17 february 2019 and returning on 7 march 2019",0.0,0.5,-1
7948,would you look up roundtrip tours from dallas to houston for march 7 and march 10,0.0,0.5,-1
7949,i want a flight caled from new york to san francisco with continental,0.0,0.5,-1
7950,catching a flight from sacremento to tampa two weeks from now and returning a month after,0.0,0.5,-1
7951,i need you to book me a shuttle from ft lauderdale to houston on southwest,0.0,0.5,-1
7952,get me a cab from ft lauderale to houston on southwest,0.0,0.5,-1
7953,compare prices for convoys from recife to miami leaving may 20 returning june 5,0.0,0.5,-1
7954,i need to get a jet out of lax to dia on the 16th for under four hundred,0.0,0.5,-1
7955,get me a train from ft lauderale to houston on southwest,0.0,0.5,-1
7956,could you make a temporary reservation with air emirates from orlando to london,0.0,0.5,-1
7957,took a flight from chicago to dc on monday and returning on wednesday,0.0,0.5,-1
7958,book me a cab from o'hare to las vegas on deltacom,0.0,0.5,-1
7959,"announced a flight from tampa, fl to baltimore, md on 11 february 2019 and returning on 19 march 2019",0.0,0.5,-1
7960,"announced a flight from key west, fl to san antonio, tx on 18 february 2019 and returning on 5 march 2019",0.0,0.5,-1
7961,cheapest fare for trains from tehran to new york on august 1 with return on august 20,0.0,0.5,-1
7962,i need to take a cab from florida to alabama on january 25th and i need to get back by the 30th,0.0,0.5,-1
7963,i am wanting you to book me a journey from houston to miami on united airlines,0.0,0.5,-1
7964,"i'm going to boston from bangor on july 25th through the 29th, and need you to find me a roundtrip ticket",0.0,0.5,-1
7965,"purchase a charter from fiji to san diego on november 1 that returns on december 1, please",0.0,0.5,-1
7966,could you get me a delta flyer from sioux falls to philadelphia for under $400,0.0,0.5,-1
7967,reserve me a cab from ft lauderdale to houston on southwest,0.0,0.5,-1
7968,search for a ship out of la to chicago on march 3rd for under $500,0.0,0.5,-1
7969,"buy a train from santa fe to jacksonville on new year's eve that returns on the fourth, please",0.0,0.5,-1
7970,completed a flight from seattle to dallas-fort worth on april the 1st and returning on april 5th,0.0,0.5,-1
7971,get me a flight caled from houston to phoenix with american airlines,0.0,0.5,-1
7972,find me a train from tijuana to guadalajara on volaris,0.0,0.5,-1
7973,"including a flight from jacksonville, fl to atlanta, ga on 14 february 2019 and returning on 1 march 2019",0.0,0.5,-1
7974,find me a train from ft lauderdale to houston on southwest,0.0,0.5,-1
7975,i need a cab from nyc to paris with delta,0.0,0.5,-1
7976,"can you find me a cab from portland, oregon to portland, maine for under $500 on delta",0.0,0.5,-1
7977,my shopping basket contains what again,0.0,0.5,-1
7978,does my bucket list include apples right now,0.0,0.5,-1
7979,what does my bucket list involve,0.0,0.5,-1
7980,can you remind me what i put on my contacts list,0.0,0.5,-1
7981,"can you tell me my bucket list items, please",0.0,0.5,-1
7982,what can you see on my email list,0.0,0.5,-1
7983,what items are on my shopping trolley,0.0,0.5,-1
7984,what all do i have on my contacts list,0.0,0.5,-1
7985,what can you see on my contacts list,0.0,0.5,-1
7986,check if my shopping trolley has tomato,0.0,0.5,-1
7987,read me everything on my bucket list,0.0,0.5,-1
7988,read me my shopping advice please,0.0,0.5,-1
7989,what is available on the shopping network,0.0,0.5,-1
7990,i need to know what is on my contacts list,0.0,0.5,-1
7991,what things are on my email list,0.0,0.5,-1
7992,tell me what my shopping obsession consists of,0.0,0.5,-1
7993,what do i have on my arm for shopping,0.0,0.5,-1
7994,what are the contents of my bucket list,0.0,0.5,-1
7995,does my shit list have tomato written on it,0.0,0.5,-1
7996,read my entire bucket list to me,0.0,0.5,-1
7997,what all is on my email list,0.0,0.5,-1
7998,tell me what is on my shopping website,0.0,0.5,-1
7999,what did i put on my naughty list so far,0.0,0.5,-1
8000,what is available on the below list,0.0,0.5,-1
8001,what do i have on my contacts list,0.0,0.5,-1
8002,do i have tomato on the wall list,0.0,0.5,-1
8003,i need to know the things on my email list,0.0,0.5,-1
8004,would you let me know what is on my guest list,0.0,0.5,-1
8005,what are the contents of my shopping basket,0.0,0.5,-1
8006,my taste for shopping has what on it,0.0,0.5,-1
8007,does my shopping experience include corn,0.0,0.5,-1
8008,what are all the things on the menu list,0.0,0.5,-1
8009,tell me what's on my contacts list,0.0,0.5,-1
8010,does my bucket list have tomato written on it,0.0,0.5,-1
8011,i need to know what i have on my contacts list,0.0,0.5,-1
8012,what does my bucket list entail,0.0,0.5,-1
8013,i need to know the things on my shopping trolley,0.0,0.5,-1
8014,what does my bucket list consist of,0.0,0.5,-1
8015,read my shopping advice to me,0.0,0.5,-1
8016,do i have a big guest list,0.0,0.5,-1
8017,tell me what my priority list consists of,0.0,0.5,-1
8018,read me everything on my shopping trips,0.0,0.5,-1
8019,i need to know what is on my guest list,0.0,0.5,-1
8020,what stuff did i put on my shit list,0.0,0.5,-1
8021,what things are on my shopping carts,0.0,0.5,-1
8022,can you tell me if i have paper towels on my bucket list,0.0,0.5,-1
8023,read me everything on my contacts list,0.0,0.5,-1
8024,tell me my guest list,0.0,0.5,-1
8025,tell me what my bucket list consists of,0.0,0.5,-1
8026,i need for you to tell me what is on my bucket list,0.0,0.5,-1
8027,do i have carrots on my shopping carts,0.0,0.5,-1
8028,i need to know the items on my shopping trolley,0.0,0.5,-1
8029,on the short list did i put tomato,0.0,0.5,-1
8030,i need to know what i have on my shopping supplies,0.0,0.5,-1
8031,what items are on my shopping carts,0.0,0.5,-1
8032,what do i have on my guest list,0.0,0.5,-1
8033,i'd like to know what's on the shopping carts,0.0,0.5,-1
8034,do i have tomato on the menu list,0.0,0.5,-1
8035,which purchases are on my contacts list,0.0,0.5,-1
8036,read off shopping magazine,0.0,0.5,-1
8037,what is available on the shopping centre,0.0,0.5,-1
8038,my appetite for shopping has what on it,0.0,0.5,-1
8039,start a new relationship,0.0,0.5,-1
8040,write another message to someone,0.0,0.5,-1
8041,send a telegram to brooklyn with the message that i will see them later,0.0,0.5,-1
8042,leave a message to alice,0.0,0.5,-1
8043,send a brief message,0.0,0.5,-1
8044,i have to have a picture sent,0.0,0.5,-1
8045,create a new character,0.0,0.5,-1
8046,i want you to send a private message for me,0.0,0.5,-1
8047,could you send a signal to marty and say i am running behind,0.0,0.5,-1
8048,i need you to send a reply,0.0,0.5,-1
8049,call robert and tell him winter is coming,0.0,0.5,-1
8050,princess alice,0.0,0.5,-1
8051,i have to send a signal,0.0,0.5,-1
8052,can you ring mary and tell them it's ready,0.0,0.5,-1
8053,create a new team,0.0,0.5,-1
8054,find paul and ask him what time the cookout is on saturday,0.0,0.5,-1
8055,dear mom where are you,0.0,0.5,-1
8056,i need sal to be oped and say i'll be there,0.0,0.5,-1
8057,send a message to natalie in the form of a sms,0.0,0.5,-1
8058,please send a messenger to phil and ask him if he wants to play golf this weekend,0.0,0.5,-1
8059,can you send a messenger to my mother irene and tell her i love her,0.0,0.5,-1
8060,kiss my wife and tell her i'm divorcing her,0.0,0.5,-1
8061,please leave a message to peter telling him to pick up milk,0.0,0.5,-1
8062,set up a new blog message,0.0,0.5,-1
8063,call my doctor and tell him it happened again,0.0,0.5,-1
8064,ask my friend for me and tell them to meet me later,0.0,0.5,-1
8065,send bill a message for me and tell him i will be 30 minutes late,0.0,0.5,-1
8066,i need to send a signal,0.0,0.5,-1
8067,send a message to alice,0.0,0.5,-1
8068,send a picture to mom i'll talk to you later,0.0,0.5,-1
8069,can you send a messenger for me,0.0,0.5,-1
8070,let sal know by monday i will be attending,0.0,0.5,-1
8071,can you ping priest chris with a reply and send the following confession,0.0,0.5,-1
8072,i want to send a reply,0.0,0.5,-1
8073,i want to send a love message to,0.0,0.5,-1
8074,create a visual message to,0.0,0.5,-1
8075,kiss my mom for me and tell them i will be home soon,0.0,0.5,-1
8076,please send a brief message to natalie for me,0.0,0.5,-1
8077,kiss my dad for me and tell them i love you,0.0,0.5,-1
8078,communicate via satellite to,0.0,0.5,-1
8079,can you telephone the sgt adam and tell them i found the missing girl,0.0,0.5,-1
8080,send a email to ashley and ask her what she wants to do for supper,0.0,0.5,-1
8081,call sal and let them know the answer is yes,0.0,0.5,-1
8082,send a telegram to someone,0.0,0.5,-1
8083,send a signal to someone,0.0,0.5,-1
8084,create a video message to,0.0,0.5,-1
8085,can you tell bob to get his dog via satellite,0.0,0.5,-1
8086,please phone nancy and give them the message that i am on vacation,0.0,0.5,-1
8087,my dte bill is how short,0.0,0.5,-1
8088,remind me of the invoice total for my plumbing supplies,0.0,0.5,-1
8089,how much is my comcast network,0.0,0.5,-1
8090,find out the cost of my bonus payments,0.0,0.5,-1
8091,tell me how much my verizon and comcast network come to together,0.0,0.5,-1
8092,how large is my electric bill for,0.0,0.5,-1
8093,can you check and see how badly i owe on my cable bill,0.0,0.5,-1
8094,what's the amount due on my latest sprint ##s,0.0,0.5,-1
8095,how important is my groceries and gas bill,0.0,0.5,-1
8096,what is my dte for this month,0.0,0.5,-1
8097,how important are my xfinity and dte bills,0.0,0.5,-1
8098,what is the my comcast address this month,0.0,0.5,-1
8099,can you tell me how much i owe on my cable contract,0.0,0.5,-1
8100,how large is my current water bill for,0.0,0.5,-1
8101,what is the amount on my water bottles,0.0,0.5,-1
8102,how large is my water bill for,0.0,0.5,-1
8103,what is the amount on my comcast channel,0.0,0.5,-1
8104,tell me how much my cable cable is,0.0,0.5,-1
8105,how much do i have on credit card security,0.0,0.5,-1
8106,please find the current balance on my con edison cable,0.0,0.5,-1
8107,find out what my water treatment costs please,0.0,0.5,-1
8108,how big are utilities,0.0,0.5,-1
8109,how much are all my vitamins combined,0.0,0.5,-1
8110,can you find out how badly i owe on my bills,0.0,0.5,-1
8111,what is the amount of balance i have to pay on my contract,0.0,0.5,-1
8112,what is my domain name anyway,0.0,0.5,-1
8113,please find the current balance on my con edison watch,0.0,0.5,-1
8114,find out the cost of my royalty payments,0.0,0.5,-1
8115,how big is my groceries and gas bill,0.0,0.5,-1
8116,how badly do i have to pay on my bills,0.0,0.5,-1
8117,the equation for water and electricity is how much,0.0,0.5,-1
8118,how powerful is my comcast bill,0.0,0.5,-1
8119,can you tell me what the amount on my directv feed is,0.0,0.5,-1
8120,can you tell me what i owe for this month's phone sex,0.0,0.5,-1
8121,how heavy are my bills,0.0,0.5,-1
8122,how much is the demand for my water and electricity,0.0,0.5,-1
8123,i need to know the cost of the cable link,0.0,0.5,-1
8124,find out what my water bottle costs please,0.0,0.5,-1
8125,how deep are my cable and water bills,0.0,0.5,-1
8126,do you know how much i owe on my cable channel,0.0,0.5,-1
8127,"for my water and electricity, how large is the bill",0.0,0.5,-1
8128,how great is my cable bill for,0.0,0.5,-1
8129,how big is my xfinity bill this month,0.0,0.5,-1
8130,how short on bills to i have to pay,0.0,0.5,-1
8131,how much is my cable channel,0.0,0.5,-1
8132,how great is my current water bill for,0.0,0.5,-1
8133,how much is my electric budget for this month,0.0,0.5,-1
8134,how much is my current cable audience for,0.0,0.5,-1
8135,how large is my electric bill for this month,0.0,0.5,-1
8136,how much do i owe on my cable network,0.0,0.5,-1
8137,what is my email subscriction services about,0.0,0.5,-1
8138,how large is the bill for my water and electricity,0.0,0.5,-1
8139,how large are my bills,0.0,0.5,-1
8140,what's the total i owe on all my debtss,0.0,0.5,-1
8141,"for my water and electricity, how much is the price",0.0,0.5,-1
8142,how badly is my electricity bill costing me,0.0,0.5,-1
8143,how large is my xfinity bill this month,0.0,0.5,-1
8144,what's my taste for water and electricity,0.0,0.5,-1
8145,how big is my water bill for,0.0,0.5,-1
8146,what's the water anyway,0.0,0.5,-1
8147,how hard do i have to pay on my bills,0.0,0.5,-1
8148,tell me how much my cable fare is,0.0,0.5,-1
8149,how important is my comcast bill,0.0,0.5,-1
8150,do you know how badly i owe on my cable bill,0.0,0.5,-1
8151,how heavy are all my bills combined,0.0,0.5,-1
8152,what is the total amount due on my electricity supplies,0.0,0.5,-1
8153,how few in total will i be paying for bills,0.0,0.5,-1
8154,can you check the balance on the water gauge,0.0,0.5,-1
8155,how much is my cable network,0.0,0.5,-1
8156,how much is the budget for my water and electricity,0.0,0.5,-1
8157,my water and electricity budget is how much,0.0,0.5,-1
8158,what is the amount on my water bottle,0.0,0.5,-1
8159,"for my water and electricity, how much is the difference",0.0,0.5,-1
8160,how big is my electric bill for this month,0.0,0.5,-1
8161,my dte bill is how nice,0.0,0.5,-1
8162,my water bill is how large this month,0.0,0.5,-1
8163,my dte and water bills are how small,0.0,0.5,-1
8164,can you find out how heavily i owe on my bills,0.0,0.5,-1
8165,tell me how short my cable bill is,0.0,0.5,-1
8166,studio location with bill,0.0,0.5,-1
8167,send my regards to my mom,0.0,0.5,-1
8168,share my dreams with sarah,0.0,0.5,-1
8169,please let my mom and dad know my story,0.0,0.5,-1
8170,can you forward my proposal to tom,0.0,0.5,-1
8171,can you share my current situation with amy,0.0,0.5,-1
8172,i need you to push my boundaries to cory,0.0,0.5,-1
8173,trey needs my current boyfriend,0.0,0.5,-1
8174,i need to share my dream with noel,0.0,0.5,-1
8175,have miranda know about my current situation,0.0,0.5,-1
8176,please tell my story to bob,0.0,0.5,-1
8177,discuss my location with mom,0.0,0.5,-1
8178,give the boys my regards please,0.0,0.5,-1
8179,share my apartment with brad and terry,0.0,0.5,-1
8180,share my dreams with my sister,0.0,0.5,-1
8181,can you share my memories with mom,0.0,0.5,-1
8182,can you match my location with my girlfriends,0.0,0.5,-1
8183,share secrets with bill,0.0,0.5,-1
8184,interview location with bill,0.0,0.5,-1
8185,send the messages i'm at with martin,0.0,0.5,-1
8186,let my group know what my current assignment is,0.0,0.5,-1
8187,give my current assignment to robyn now,0.0,0.5,-1
8188,share my thoughts with ma,0.0,0.5,-1
8189,let shih chieh see my reaction,0.0,0.5,-1
8190,inform bill and craig of my findings,0.0,0.5,-1
